text,label
breakfast,pan-frying
cook,pan-frying
egg,pan-frying
fry,pan-frying
breakfast eggs in frying pan,pan-frying
quick morning breakfast fry,pan-frying
cook sunny side up egg,pan-frying
cook bacon and eggs,pan-frying
egg frying in pan,pan-frying
over-easy egg in skillet,pan-frying
fry vegetables in pan,pan-frying
fry fish fillet,pan-frying
frying pan with egg sizzling,pan-frying
skillet with breakfast food,pan-frying
egg in frying pan sunny side up,pan-frying
cooking breakfast in non-stick pan,pan-frying
sauté pan for quick frying,pan-frying
stovetop pan for morning fry-up,pan-frying
pan with butter and egg frying,pan-frying
cast iron skillet for egg frying,pan-frying
cooking icon for breakfast meal,pan-frying
frying pan with food bubbling,pan-frying
I need a frying pan icon for the breakfast recipe,pan-frying
add an egg in pan symbol to the cooking section,pan-frying
show a frying pan for the breakfast menu,pan-frying
use the pan icon for the morning cook screen,pan-frying
friyng pan egg,pan-frying
breakafst cook,pan-frying
eeg frying,pan-frying
pan fryng,pan-frying
casserole dish for oven baking,pan-frying
pot with lid for boiling,pan-frying
wok for high-heat stir-fry,pan-frying
grill for barbecue cooking,pan-frying
toaster for making toast,pan-frying
deep fryer basket for french fries,pan-frying
