text,label
directions from street view,street-view
turn by turn directions walking,street-view
street view location pin dropped,street-view
360 location view,street-view
map street view panorama,street-view
street level map view,street-view
navigation street view mode,street-view
driving navigation street view,street-view
user on map street view,street-view
person icon on map,street-view
google maps street view pegman,street-view
360 degree panoramic street view,street-view
walking person icon dropped on map,street-view
explore neighborhood via street view,street-view
virtual tour of city street view,street-view
street view camera car capture,street-view
business interior street view,street-view
find address via street level view,street-view
pedestrian navigation street level,street-view
drag and drop person on map for street view,street-view
show street view for the explore nearby option,street-view
steet view navigation,street-view
streeet view map,street-view
navigaiton street view,street-view
locaiton street,street-view
