text,label
hydration,tank-water
hydration water tank drinking,tank-water
water tank for hydration supply,tank-water
water storage tank large,tank-water
storage tank holding water,tank-water
water tank outdoor barrel,tank-water
rainwater collection tank,tank-water
rooftop water storage tank,tank-water
underground water tank cistern,tank-water
plastic water tank for camping,tank-water
water tower large community tank,tank-water
fish tank aquarium water,tank-water
hot water heater tank home,tank-water
septic tank underground water,tank-water
fire suppression water tank,tank-water
water tank truck delivery,tank-water
rainwater harvesting tank garden,tank-water
I need a water tank icon for the storage section,tank-water
add a tank symbol to the water management feature,tank-water
show a water tank for the resource tracking,tank-water
use the tank-water icon for the hydration system,tank-water
wter tank storage,tank-water
hydation tank water,tank-water
storrage water tank,tank-water
watertank supply,tank-water
water bottle personal drinking,tank-water
water glass cup hydration,tank-water
barrel wooden cask storage,tank-water
swimming pool water outdoor,tank-water
bucket water container handle,tank-water
rain barrel garden water collection,tank-water
