text,label
asl,hands
deaf,hands
hands,hands
asl alphabet fingerspelling letter,hands
asl interpreter signing at event,hands
deaf community using sign language,hands
deaf awareness month symbol,hands
two hands open facing up,hands
hands raised in greeting gesture,hands
two open hands facing upward in sign language,hands
sign language interpreter hands in motion,hands
ASL hands spelling a word gesture,hands
deaf community hand communication symbol,hands
raised hands together for applause,hands
open palms facing each other for exchange,hands
hands icon for accessibility features,hands
two hands used in American Sign Language,hands
cupped hands holding something gently,hands
hands gesturing during conversation,hands
show hands for the ASL interpreter feature,hands
hads signing asl gesture,hands
sign langauge hands icon,hands
asl hande spelling alphabet,hands
deaf communtiy hands signal,hands
