text,label
соглашение,handshake
приветствие,handshake
встреча,handshake
партнерство,handshake
деловое соглашение закреплено рукопожатием,handshake
соглашение подписано после переговоров,handshake
дружеское приветствие крепким рукопожатием,handshake
приветствие коллег на конференции,handshake
официальная встреча начинается с рукопожатия,handshake
первая встреча двух руководителей,handshake
партнерство стартапов оформлено рукопожатием,handshake
сделка о партнерстве объявлена на саммите,handshake
две руки сцеплены в рукопожатии,handshake
крепкое деловое рукопожатие закрепляет сделку,handshake
приветственное рукопожатие на нетворкинге,handshake
иконка рукопожатия для contracts app,handshake
партнерство выражено двумя соединенными руками,handshake
дипломатическое рукопожатие между сторонами,handshake
эмодзи рукопожатия как подтверждение сделки,handshake
клиент и консультант пожимают руки после встречи,handshake
доверие и сотрудничество как рукопожатие,handshake
рукопожатие для функции collaboration или team building,handshake
показать рукопожатие на экране подтверждения соглашения,handshake
крепкое рукопожатие закрепляет сделку,handshake
деловое рукопожатие на встрече,handshake
партнерство подтверждено рукопожатием,handshake
приветственное рукопожатие на конференции,handshake
удар кулаками между друзьями,handshake
дай пять как жест празднования,handshake
машущая рука как привет или прощание,handshake
большой палец вверх как согласие,handshake
хлопающие ладони как аплодисменты,handshake
молящиеся руки вместе,handshake
