text,label
camping,flashlight
electric,flashlight
equipment,flashlight
flashlight,flashlight
hide and seek,flashlight
lamp,flashlight
light,flashlight
torch,flashlight
reservar camping en línea,flashlight
reservar electric en línea,flashlight
reservar equipment en línea,flashlight
reservar flashlight en línea,flashlight
reservar hide and seek en línea,flashlight
reservar lamp en línea,flashlight
reservar light en línea,flashlight
reservar torch en línea,flashlight
no olvidar camping,flashlight
no olvidar electric,flashlight
no olvidar equipment,flashlight
no olvidar flashlight,flashlight
no olvidar hide and seek,flashlight
no olvidar lamp,flashlight
no olvidar light,flashlight
no olvidar torch,flashlight
camping por la noche,flashlight
electric por la noche,flashlight
equipment por la noche,flashlight
flashlight por la noche,flashlight
hide and seek por la noche,flashlight
lamp por la noche,flashlight
light por la noche,flashlight
torch por la noche,flashlight
camping después del trabajo,flashlight
electric después del trabajo,flashlight
equipment después del trabajo,flashlight
flashlight después del trabajo,flashlight
hide and seek después del trabajo,flashlight
lamp después del trabajo,flashlight
light después del trabajo,flashlight
torch después del trabajo,flashlight
camping este fin de semana,flashlight
electric este fin de semana,flashlight
equipment este fin de semana,flashlight
flashlight este fin de semana,flashlight
hide and seek este fin de semana,flashlight
lamp este fin de semana,flashlight
light este fin de semana,flashlight
torch este fin de semana,flashlight
camping mañana,flashlight
electric mañana,flashlight
equipment mañana,flashlight
flashlight mañana,flashlight
hide and seek mañana,flashlight
lamp mañana,flashlight
light mañana,flashlight
hide and seek estte fin de semana,flashlight
no olvdar electric,flashlight
no olvidar flaashlight,flashlight
flashlight despéus del trabajo,flashlight
no olviar equipment,flashlight
