text,label
cable,ethernet
cat 5,ethernet
cat 6,ethernet
connection,ethernet
wired,ethernet
Plug in the ethernet cable,ethernet
Use a Cat 5 cable for the network,ethernet
Replace the old Cat 5 cable,ethernet
Upgrade to a Cat 6 cable,ethernet
Install Cat 6 for faster speed,ethernet
Check the network connection,ethernet
Fix the unstable connection,ethernet
Set up the network hardware,ethernet
Buy new networking hardware,ethernet
Connect to the internet via cable,ethernet
Troubleshoot internet connection,ethernet
Set up the home network,ethernet
Add a device to the network,ethernet
Use wired connection for stability,ethernet
Switch from wifi to wired,ethernet
Connect the computer via ethernet,ethernet
Buy a longer ethernet cable,ethernet
Use wired internet for faster speed,ethernet
Set up the home network,ethernet
Plug the router into the wall,ethernet
Fix the slow internet connection,ethernet
Set up a wired gaming connection,ethernet
Replace the old network cable,ethernet
Connect the smart TV via ethernet,ethernet
Run an ethernet cable through the wall,ethernet
Plug in the cable,ethernet
Wired connection,ethernet
Ethernet setup,ethernet
Network cable,ethernet
plug in the etehrnet cable,ethernet
use wried connection,ethernet
buy a cat6 cabel,ethernet
fix the internt connection,ethernet
