text,label
DIMM,memory
ОЗУ,memory
планка DIMM для настольного компьютера,memory
модуль памяти DIMM апгрейд,memory
модуль ОЗУ установленный в материнскую плату,memory
апгрейд ОЗУ для быстрого компьютера,memory
компоненты аппаратного обеспечения компьютера,memory
магазин для деталей ПК,memory
апгрейд хранилища планкой ОЗУ,memory
системное хранилище и ОЗУ,memory
апгрейд технологий модуль памяти,memory
микросхема ОЗУ аппаратного обеспечения,memory
планка ОЗУ вставленная в слот материнской платы,memory
модуль памяти DDR5 для игрового ПК,memory
апгрейд ОЗУ компьютера для лучшей производительности,memory
модуль DIMM с теплораспределителем,memory
системная память для запуска приложений,memory
микросхема памяти на плате,memory
карта памяти SO-DIMM для ноутбука,memory
серверный модуль памяти для дата-центра,memory
индикатор ОЗУ в системных настройках,memory
установить ОЗУ для ускорения компьютера,memory
показать планку памяти для руководства по апгрейду,memory
модуль ОЗУ апгреды,memory
планка памяит DIMM,memory
память модуль аарудование,memory
ОЗУ микросхема комьпютер,memory
процессор CPU на материнской плате,memory
SSD твердотельный накопитель для хранения,memory
жёсткий диск HDD вращающийся,memory
видеокарта GPU для игр,memory
микросхема интегральная схема,memory
USB флешка для портативного хранения,memory
