text,label
процессор,microchip
процессор,microchip
технологии,microchip
чип процессора на материнской плате,microchip
тест производительности CPU,microchip
компонент оборудования микросхема,microchip
апгрейд аппаратного обеспечения процессор,microchip
скорость процессора для игр,microchip
многоядерный процессорный чип,microchip
технологии внутри компьютера,microchip
передовой технологический чип,microchip
интегральная схема на зелёной плате PCB,microchip
кристалл CPU с контактами в сокете материнской платы,microchip
микропроцессор с печатными проводниками,microchip
чип искусственного интеллекта для машинного обучения,microchip
полупроводниковый микрочип нанометрового масштаба,microchip
RFID микросхема для отслеживания,microchip
концепция мозгового имплантата микрочипа,microchip
кремниевая пластина с кристаллами микросхем,microchip
крошечный чип питающий умные устройства,microchip
дефицит чипов влияющий на поставки электроники,microchip
Мне нужна иконка микросхемы для раздела оборудования,microchip
добавить символ чипа CPU в технические характеристики,microchip
показать иконку процессора для экрана производительности,microchip
использовать иконку микросхемы для вкладки функций ИИ,microchip
микросхмеа процессор,microchip
процессро CPU,microchip
аппартное обеспечение чип,microchip
технолгии микросхема,microchip
планка памяти ОЗУ DIMM,microchip
жёсткий диск HDD для хранения данных,microchip
чип видеокарты GPU,microchip
плата с множеством компонентов,microchip
USB накопитель портативное хранение,microchip
чип процессора смартфона внутри устройства,microchip
