text,label
employees group users icon,users
multiple employees list,users
together users group community,users
together friends users,users
user group users icon,users
multiple users account,users
users people community together,users
users list people,users
multiple users group icon,users
team members users list,users
community users together,users
contacts list multiple people,users
shared account users icon,users
followers users social profile,users
admin manage users panel,users
users online active count,users
group chat users together,users
organization users directory,users
I need a users icon for the team section,users
add a people symbol to the community feature,users
show users for the group management screen,users
use the users icon for the contacts list,users
mulitple users group,users
employess together team,users
communtiy users together,users
single user person profile,users
user add new person plus,users
friends list social media,users
crowd many people gathered,users
team sports group players,users
family group related persons,users
