text,label
группа сотрудников иконка пользователей,users
список нескольких сотрудников,users
вместе группа пользователей сообщество,users
друзья пользователи вместе,users
группа пользователей иконка,users
несколько пользователей аккаунт,users
пользователи люди сообщество вместе,users
список пользователей люди,users
иконка группы нескольких пользователей,users
члены команды список пользователей,users
сообщество пользователей вместе,users
список контактов несколько людей,users
общий аккаунт иконка пользователей,users
подписчики пользователи социальный профиль,users
администратор управление пользователями панель,users
активные пользователи онлайн счётчик,users
групповой чат пользователи вместе,users
каталог организации пользователей,users
несколько пользователей группа,users
сотрудники вместе команда,users
один пользователь профиль человека,users
добавить нового пользователя плюс,users
список друзей социальные сети,users
толпа много людей собравшихся,users
спортивная команда группа игроков,users
семья группа родственников,users
пользователи,users
участники команды,users
группа,users
учётные записи,users
пригласить новых пользователей в команду,users
проверить список пользователей в панели админа,users
удалить неактивных пользователей из аккаунта,users
настроить права пользователей для проекта,users
добавить пользователя в общее рабочее пространство,users
экспортировать список пользователей в таблицу,users
сбросить пароль пользователя,users
создать учётные записи для стажёров,users
назначить пользователей в группу проекта,users
обновить роли пользователей в системе,users
онбординг нового пользователя до понедельника,users
аудит доступа пользователей к квартальному обзору,users
аккаунты участников для нового проекта,users
чистка прав пользователей на этой неделе,users
пользователи общего пространства нуждаются в обновлении,users
деактивировать пользователей которые ушли,users
приглашения пользователей до встречи,users
сессия управления пользователями в админке,users
добавить пользователей,users
удалить пользователей,users
список пользователей,users
права пользователей,users
слишком много неактивных пользователей в системе,users
нужно добавить новичков в команду,users
кто-то забыл удалить старых пользователей,users
список пользователей стал очень длинным,users
у кого сейчас админский доступ,users
приглсаить новых ползователей,users
проврить списко пользовтаелей,users
удалтиь неактвиных пользовтелей,users
добваить пользоватля в рабочее простанрство,users
