text,label
API,webhook
Automatisierung,webhook
verbinden,webhook
Hook,webhook
Integration,webhook
Trigger,webhook
Webhook,webhook
Endpunkt,webhook
Callback,webhook
Payload,webhook
HTTP POST,webhook
Benachrichtigung,webhook
automatisieren,webhook
API-Schlüssel,webhook
JSON,webhook
Ereignis,webhook
Anfrage,webhook
Server,webhook
Webhook für neue Bestellungen einrichten,webhook
API-Integration mit Slack konfigurieren,webhook
Workflow mit einem Webhook-Trigger automatisieren,webhook
prüfen ob der Webhook Ereignisse empfängt,webhook
Callback-URL für Zahlungsbenachrichtigungen hinzufügen,webhook
Webhook mit einem Test-Payload testen,webhook
API-Schlüssel für die Integration aktualisieren,webhook
defekten Webhook-Endpunkt reparieren,webhook
Automatisierung für neue Kundenanmeldungen einrichten,webhook
Webhook mit dem CRM-System verbinden,webhook
Webhook beim Absenden des Formulars auslösen,webhook
Webhook-Logs auf fehlgeschlagene Zustellungen prüfen,webhook
neue Integration für E-Mail-Benachrichtigungen hinzufügen,webhook
Webhook-URL nach dem Serverumzug aktualisieren,webhook
Rechnungserstellung per API-Aufruf automatisieren,webhook
der Webhook sendet keine Benachrichtigungen mehr,webhook
API-Schlüssel muss diese Woche rotiert werden,webhook
Webhook-Payload fehlen Pflichtfelder,webhook
fehlgeschlagene Webhook-Zustellung wiederholen,webhook
Webhook für Chat-Nachrichten einrichten,webhook
Integration mit dem Zahlungs-Gateway funktioniert nicht,webhook
Endpunkt für JSON-Empfang konfigurieren,webhook
Automatisierung spart uns jede Woche Stunden,webhook
das API-Ratelimit wird ständig erreicht,webhook
Webhook für Versandstatus-Updates hinzufügen,webhook
Webhook-Signatur vor der Verarbeitung prüfen,webhook
Abrechnungssystem mit der Hauptanwendung verbinden,webhook
Callback-URL muss aktualisiert werden,webhook
Server hat beim Webhook-Aufruf einen Fehler zurückgegeben,webhook
API-Migration für den nächsten Sprint planen,webhook
neues Tool an unsere Automatisierung anbinden,webhook
Ereignis-Trigger vor dem Go-Live testen,webhook
Webhook wird bei jedem neuen Ticket ausgelöst,webhook
Alarme für Webhook-Fehler einrichten,webhook
API-Endpunkte für das Team dokumentieren,webhook
prüfen ob die Integration Wiederholungen verarbeitet,webhook
Webhook für neue Bestellugen einrichten,webhook
API-Integation mit Slack konfigurieren,webhook
Automatisierug mit Webhook-Trigger,webhook
Webhook-Logs auf Fehler prüfn,webhook
Triggr den Webhook beim Absenden,webhook
API-Verfügbarkeits-Dashboard überwachen,webhook
