text,label
акрил,palette
искусство,palette
палитра художника,palette
кисть,palette
цвет,palette
заливка,palette
музей,palette
краска,palette
рисование,palette
палитра,palette
пигмент,palette
акварель,palette
акриловая краска на палитре художника,palette
акриловые цвета смешанные на палитре,palette
палитра цветов изобразительного искусства,palette
иконка палитры художественной выставки,palette
палитра художника с каплями краски,palette
палитра художника в руке живописца,palette
кисть окунутая в цвета палитры,palette
смешивать цвета на кисти с палитрой,palette
палитра выбора цвета в приложении,palette
инструмент палитры выбора цвета,palette
заполнить фигуру цветом из палитры,palette
заливка цветом из палитры,palette
символ палитры художественного музея,palette
иконка музея искусства палитра,palette
выбор краски на доске палитры,palette
краска смешанная на деревянной палитре,palette
выбор палитры инструмента живописи,palette
палитра цветов живописи на холсте,palette
классическая овальная палитра с отверстием для пальца,palette
иконка палитры для художественного приложения,palette
смешивание пигментов на палитре художника,palette
капли пигмента на овальной палитре,palette
палитра акварели с ячейками,palette
поднос акварельной палитры,palette
овальная деревянная палитра с цветными каплями краски,palette
художник держащий палитру во время рисования,palette
цифровой выбор цветовой палитры в приложении дизайна,palette
палитра образцов цвета для фирменного дизайна,palette
палитра маляра с отверстием для большого пальца,palette
палитра урока рисования для смешивания цветов,palette
иконка музея искусства с палитрой художника,palette
поднос акварельной палитры с 12 цветами,palette
компонент цветовой палитры UI,palette
инструмент цветовой палитры графического дизайна,palette
Мне нужна иконка палитры для раздела искусства,palette
добавить цветовую палитру в инструмент рисования,palette
показать палитру для функции выбора цвета,palette
использовать иконку палитры для выбора цвета дизайна,palette
палитра цвет искустство,palette
палитра художина,palette
цвет палитра иснтрумент,palette
рисоваение палитра,palette
инструмент кисть без палитры,palette
таблица образцов цвета без формы палитры,palette
малярный валик для стен не для искусства,palette
чернильница и перьевая ручка,palette
коробка мелков с несколькими цветами,palette
баллончик с краской для покрытия,palette
