text,label
alphabet,braille
blind,braille
dots,braille
raised,braille
vision,braille
learn the braille alphabet,braille
accessibility for blind users,braille
raised dots reading,braille
raised text for the visually impaired,braille
vision impairment accessibility,braille
Learn to read braille,braille
Add braille labels to the buttons,braille
Braille reading tutorial,braille
Accessibility features for blind users,braille
Print materials in braille,braille
Braille signage for the building,braille
Study braille for the project,braille
Braille awareness workshop,braille
Request braille materials for the event,braille
Install braille signs in the office,braille
I want to learn how to read braille,braille
The museum should have braille labels,braille
Let's add braille to the signage,braille
Accessibility needs to include braille,braille
Lern to read brail,braille
Add braile labels to the buttons,braille
Brail signge for the building,braille
Acessibility featrues for blnd users,braille
Accessibility audit for the website,braille
Sign language interpreter booking,braille
Hearing aid fitting appointment,braille
Wheelchair ramp installation,braille
Large print materials request,braille
Screen reader setup,braille
Braille alphabet chart on the wall,braille
Blind-accessible design for the app,braille
Dots pattern on the keypad buttons,braille
Raised surface label for the jar lid,braille
Vision test scheduled for next week,braille
