text,label
flora,spa
massage,spa
mindfulness,spa
plant,spa
wellness,spa
tropical flora in a zen garden,spa
flora arrangement at the spa entrance,spa
deep tissue massage at the spa,spa
massage table with soft towels,spa
mindfulness meditation in a calm spa space,spa
mindfulness session for stress relief,spa
lush green plant in a spa lobby,spa
plant icon for a wellness or nature app,spa
wellness retreat at a luxury spa,spa
wellness icon for a health tracking app,spa
lotus flower or leaf icon in a tranquil setting,spa
book a spa treatment for relaxation,spa
wellness category icon in a self-care app,spa
delicate floral symbol suggesting peace and calm,spa
spa day for a birthday or anniversary gift,spa
beauty and wellness icon for a booking platform,spa
soft leaf or flower motif on a spa sign,spa
unwind with a spa massage after a stressful week,spa
holistic health icon representing relaxation services,spa
serene spa symbol with a botanical design,spa
I need a spa icon for my wellness booking app,spa
add a spa symbol to the relaxation section,spa
show a spa icon for the self-care category,spa
use the spa icon for the mindfulness feature,spa
sap treatment at the resort,spa
spaa for a relaxing weekend,spa
spa massge booking,spa
spa mindfulnes retreat,spa
yoga pose silhouette in a meditation app,spa
person sitting in a lotus yoga pose,spa
scented candle flickering on a wooden surface,spa
aromatherapy candle with a calming fragrance,spa
hot spring pool with steam rising from the water,spa
steaming bath icon for a hot tub or sauna,spa
