text,label
паукообразное,spider
жук,spider
шарлотта,spider
ползти,spider
восемь,spider
насекомое,spider
паук,spider
восьминогий паук висит на паутине,spider
паукообразное ползет по потолку,spider
жуткий жук висит на паутине,spider
иконка жука для halloween app,spider
паук шарлотта плетет свою паутину,spider
шарлотта из известной книги про паука,spider
паук ползет по стене ночью,spider
паук спускается по шелковой нити,spider
восемь лап широко раскинуты на паутине,spider
восемь глаз смотрят из темного угла,spider
halloween spider decoration висит в окне,spider
жуткий halloween spider на оранжевом фоне,spider
иконка насекомого для science app,spider
жуткое насекомое ползет по полу,spider
большой волосатый паук в паутине,spider
паук свисает на одной нити,spider
черный паук с восемью ногами на паутине,spider
декоративный паук на halloween у порога,spider
иконка природы для bug guide app,spider
силуэт паука с круглым телом и длинными лапами,spider
символ страха пауков в приложении,spider
иконка паукообразного для biology app,spider
маленький паук висит на длинной нити,spider
паук плетет спиральную сеть между ветвями,spider
иконка halloween для страха и неизвестности,spider
волосатый паук-птицеед сверху,spider
нужна иконка spider для halloween app,spider
добавить символ spider в раздел creepy crawlies,spider
показать паука для bug and insect category,spider
использовать иконку spider для haunted house feature,spider
паук на потолке,spider
паук ползет по стене,spider
паук висит на паутине,spider
паук с восемью ногами,spider
скорпион с изогнутым жалом,spider
пустынный скорпион щиплет клешнями,spider
муравей несет крошку по кухонному полу,spider
черный муравей идет цепочкой,spider
сложная паутина между двумя углами,spider
липкая паутина с каплями росы,spider
