text,label
инвалид,wheelchair
пользователь,wheelchair
люди,wheelchair
символ доступности для инвалидов,wheelchair
вспомогательное средство мобильности,wheelchair
помощь пользователю в инвалидной коляске,wheelchair
пользователи с потребностями мобильности,wheelchair
группа людей с ограниченными возможностями,wheelchair
поддержка доступности для людей,wheelchair
символ доступности для колясочников,wheelchair
вспомогательное средство мобильности для инвалида,wheelchair
знак парковки для инвалидов,wheelchair
человек в ручной инвалидной коляске,wheelchair
указатель доступного туалета,wheelchair
значок доступности для инвалидов,wheelchair
электрическая инвалидная коляска,wheelchair
маршрут доступности по пандусу,wheelchair
устройство мобильности для особых нужд,wheelchair
универсальный символ доступности,wheelchair
мне нужна иконка коляски для настроек доступности,wheelchair
добавь символ коляски на страницу служб для инвалидов,wheelchair
покажи коляску для раздела доступных маршрутов,wheelchair
используй иконку коляски для функции помощи мобильности,wheelchair
инвалидная каляска символ доступности,wheelchair
колясака инвалид иконка,wheelchair
инвалиднось символ мобильности,wheelchair
доступностb коляска пользователь,wheelchair
трость для пожилых людей,wheelchair
костыли медицинское средство мобильности,wheelchair
человек идёт с тростью,wheelchair
скутер мобильности для пожилых,wheelchair
символ пешехода,wheelchair
протез медицинское устройство,wheelchair
