text,label
адрес,map
координаты,map
пункт назначения,map
gps,map
локализация,map
местоположение,map
карта,map
навигация,map
бумага,map
булавка,map
место,map
достопримечательность,map
позиция,map
маршрут,map
путешествие,map
мир,map
карта мира,map
адрес улицы на сложенной карте,map
инструмент поиска адреса на карте,map
GPS координаты на бумажной карте,map
сетка координат карты,map
пункт назначения отмечен на дорожной карте,map
маршрут до пункта назначения на карте,map
GPS маршрут на экране карты,map
экран GPS навигации карты,map
локализовать результаты на карте,map
локализовать места на региональной карте,map
местоположение показано на напечатанной карте,map
бросить местоположение на лист карты,map
дорожная карта города,map
вид карты района,map
навигация по бумажной карте,map
навигация по карте в дорожных поездках,map
бумажная карта сложенная для путешествия,map
напечатанная карта региона,map
булавка на карте отмечающая ориентир,map
несколько булавок на городской карте,map
живописное место на карте,map
туристическое место отмеченное на карте,map
достопримечательность обозначена на карте,map
туристическая достопримечательность на карте,map
текущая позиция на виде карты,map
GPS позиция на карте,map
маршрут нарисованный на дорожной карте,map
живописный маршрут выделенный на карте,map
маршрут путешествия показан на карте,map
маршрут путешествия по странам,map
карта мира со всеми континентами,map
глобальный плакат карты мира,map
обои с картой мира и странами,map
карта мира для урока географии,map
сложенная бумажная дорожная карта для поездки,map
туристическая карта города с достопримечательностями,map
топографическая карта с линиями высот,map
карта мира со всеми странами и океанами,map
физическая карта с рельефными особенностями,map
цифровая карта на экране,map
схема метро для навигации общественным транспортом,map
карта пешеходных маршрутов для активного отдыха,map
карта сокровищ ведущая к тайному месту,map
карта погоды показывающая региональный прогноз,map
Мне нужна иконка карты для раздела путешествий,map
добавить символ карты в функцию навигации,map
показать карту для экрана планирования маршрута,map
использовать иконку карты для мирового вида,map
крата мира,map
навигациа карта,map
маршурт на карте,map
пункт назначениа карта,map
каплевидная булавка местоположения на карте,map
GPS прицел нацеленный на позицию,map
глобус показывающий всю землю,map
карта показывающая булавку с точкой,map
роза ветров для навигации,map
спутниковый вид рельефа сверху,map
