text,label
Right Thought Bubble,thought-bubble
balloon,thought-bubble
bubble,thought-bubble
comic,thought-bubble
dream,thought-bubble
idea,thought-bubble
imagination,thought-bubble
think,thought-bubble
thought,thought-bubble
thought balloon,thought-bubble
thought bubble,thought-bubble
Right Thought Bubble por la noche,thought-bubble
balloon por la noche,thought-bubble
bubble por la noche,thought-bubble
comic por la noche,thought-bubble
dream por la noche,thought-bubble
idea por la noche,thought-bubble
imagination por la noche,thought-bubble
think por la noche,thought-bubble
thought por la noche,thought-bubble
thought balloon por la noche,thought-bubble
thought bubble por la noche,thought-bubble
Right Thought Bubble después del trabajo,thought-bubble
balloon después del trabajo,thought-bubble
bubble después del trabajo,thought-bubble
comic después del trabajo,thought-bubble
dream después del trabajo,thought-bubble
idea después del trabajo,thought-bubble
imagination después del trabajo,thought-bubble
think después del trabajo,thought-bubble
thought después del trabajo,thought-bubble
thought balloon después del trabajo,thought-bubble
thought bubble después del trabajo,thought-bubble
comparar Right Thought Bubble,thought-bubble
comparar balloon,thought-bubble
comparar bubble,thought-bubble
comparar comic,thought-bubble
comparar dream,thought-bubble
comparar idea,thought-bubble
comparar imagination,thought-bubble
comparar think,thought-bubble
comparar thought,thought-bubble
comparar thought balloon,thought-bubble
comparar thought bubble,thought-bubble
Right Thought Bubble para el viaje,thought-bubble
balloon para el viaje,thought-bubble
bubble para el viaje,thought-bubble
comic para el viaje,thought-bubble
dream para el viaje,thought-bubble
idea para el viaje,thought-bubble
imagination para el viaje,thought-bubble
think para el viaje,thought-bubble
thought para el viaje,thought-bubble
thought balloon para el viaje,thought-bubble
thought bubble para el viaje,thought-bubble
ballloon,thought-bubble
thought bubbble por la noche,thought-bubble
comprar imagination,thought-bubble
imgaination después del trabajo,thought-bubble
thought poor la noche,thought-bubble
