text,label
Right Thought Bubble,thought-bubble
balloon,thought-bubble
bubble,thought-bubble
comic,thought-bubble
dream,thought-bubble
idea,thought-bubble
imagination,thought-bubble
think,thought-bubble
thought,thought-bubble
thought balloon,thought-bubble
thought bubble floating right side,thought-bubble
thought cloud rising from head,thought-bubble
speech balloon comic thought,thought-bubble
balloon thought comic strip,thought-bubble
chat bubble round thought,thought-bubble
thought bubble message,thought-bubble
comic strip thought cloud,thought-bubble
comic book thought bubble art,thought-bubble
dream sequence thought bubble,thought-bubble
daydream cloud floating,thought-bubble
idea thought bubble lightbulb,thought-bubble
idea popping up thought,thought-bubble
imagination bubble creative mind,thought-bubble
imagination cloud brainstorm,thought-bubble
think deeply thought bubble,thought-bubble
think and reflect bubble,thought-bubble
thought cloud word balloon,thought-bubble
thought floating away,thought-bubble
thought balloon conversation art,thought-bubble
cartoon thought balloon,thought-bubble
thought bubble above character head comics,thought-bubble
dreaming cloud floating idea visualization,thought-bubble
brainstorming thought cloud design,thought-bubble
silent thought bubble no speech,thought-bubble
thinking emoji thought bubble,thought-bubble
rounded cloud thought bubble shape,thought-bubble
comic panel character thinking silently,thought-bubble
pensive thought cloud above figure,thought-bubble
idea visualization thought cloud rising,thought-bubble
creative thinking bubble animated,thought-bubble
I need a thought bubble icon for the brainstorm feature,thought-bubble
add a think cloud symbol to the idea section,thought-bubble
show a thought bubble for the creative mode,thought-bubble
use the thought-bubble icon for the reflection widget,thought-bubble
thougth bubble comic,thought-bubble
thoguht cloud idea,thought-bubble
drema bubble floating,thought-bubble
imagiantion cloud think,thought-bubble
speech bubble dialogue talking,thought-bubble
chat message conversation balloon,thought-bubble
lightbulb idea bright concept,thought-bubble
cloud sky white fluffy,thought-bubble
dream moon night sleep,thought-bubble
exclamation thought surprise reaction,thought-bubble
