text,label
здание с деревом городской дизайн,tree-city
зелёное здание город дерево,tree-city
городская улица с деревьями,tree-city
городской парк дерево,tree-city
планирование городских деревьев,tree-city
городское зелёное пространство дерево,tree-city
городской горизонт с деревьями на переднем плане,tree-city
городской парк зелёное пространство,tree-city
городской бульвар с деревьями,tree-city
сад на крыше городской зелёный,tree-city
инициатива по посадке деревьев в городе,tree-city
зелёный город устойчивое городское планирование,tree-city
уличное дерево городской тротуар,tree-city
городской лес биоразнообразие,tree-city
покрытие кронами деревьев городская зона,tree-city
уход за деревьями обрезка в городе,tree-city
нужна иконка дерево-город для раздела устойчивого развития,tree-city
добавь символ городского дерева к функции городского планирования,tree-city
покажи иконку зелёного города для категории природы,tree-city
используй иконку дерево-город для экологических проектов,tree-city
городское дерево зелёный,tree-city
городской парк дерево,tree-city
здание город зелёное дерево,tree-city
планирование деревьев город,tree-city
деревья высажены вдоль главного бульвара,tree-city
программа городского лесоводства для центра города,tree-city
зелёный коридор соединяет городские парки с деревьями,tree-city
карта кронового покрова для городского района,tree-city
иконка эко-города со зданием и деревом,tree-city
акция общественной посадки деревьев в районе,tree-city
снижение температуры городского острова тепла через деревья,tree-city
выбор видов уличных деревьев для городской сетки,tree-city
иконка парка и дерева для дашборда умного города,tree-city
местные деревья высажены вдоль нового маршрута,tree-city
сад на крыше городского здания,tree-city
инвентаризация деревьев в базе данных городского планирования,tree-city
биоразнообразие растёт благодаря программе городских деревьев,tree-city
устойчивый городской дизайн с интеграцией деревьев,tree-city
сертификат зелёного города с символом дерева,tree-city
нужна иконка дерево-город для приложения устойчивого развития,tree-city
добавить символ городского дерева в городской планировщик,tree-city
показать иконку зелёного города в разделе эко-проектов,tree-city
использовать иконку дерево-город для городских зелёных зон,tree-city
икона планирования городского дерева,tree-city
зелёный город с деревьями и зданиями,tree-city
эко-город инициатива посадки деревьев,tree-city
покрытие кронами деревьев в городе,tree-city
иконка зелёного пространства умного города,tree-city
устойчивый городской дизайн с деревом,tree-city
