text,label
money bag,sack-dollar
moneybag,sack-dollar
robber,sack-dollar
money bag with dollar sign on side,sack-dollar
burlap bag stuffed with cash,sack-dollar
cash-filled dollar bag tied at top,sack-dollar
save money in a dollar bag,sack-dollar
dollar sign on a bulging money bag,sack-dollar
dollar amount in a tied sack,sack-dollar
investment returns shown as money bag,sack-dollar
watch the money bag grow,sack-dollar
money bag representing savings or earnings,sack-dollar
pile of money bags in vault,sack-dollar
earn a bag of cash,sack-dollar
bag full of dollar cash,sack-dollar
premium tier shown with gold money bag,sack-dollar
premium plan costs money,sack-dollar
robber fleeing with dollar-sign sack,sack-dollar
cartoon robber with striped money bag,sack-dollar
salary paid into the money bag,sack-dollar
salary day money bag notification,sack-dollar
Santa sack filled with dollar bills,sack-dollar
Santa bag overflowing with cash,sack-dollar
USD dollar bag for US currency,sack-dollar
usd money bag in finance tracker,sack-dollar
overflowing bag of cash with dollar sign,sack-dollar
budget goal reached with cash bag,sack-dollar
dollar sack representing investment returns,sack-dollar
paid tier with a money bag,sack-dollar
salary notification with dollar bag graphic,sack-dollar
cartoon robber clutching a dollar-sign money bag,sack-dollar
Santa Claus dollar-bag overflowing with riches,sack-dollar
bank vault with stacked money bags,sack-dollar
budget goal visualized as a filled money bag,sack-dollar
track savings with a money bag,sack-dollar
check the earnings bag,sack-dollar
open the bag of cash,sack-dollar
grow the investment money bag,sack-dollar
stash dollar bills in a money bag,sack-dollar
greeen money bag with dollar sign,sack-dollar
overfowing bag of cash with dollar,sack-dollar
salay notification with dollar bag,sack-dollar
dollare sack for investment returns,sack-dollar
coin stack pile representing savings,sack-dollar
piggy bank for accumulating savings,sack-dollar
wallet with dollar bills and credit card,sack-dollar
gold bar brick for investment value,sack-dollar
safe vault locked with combination dial,sack-dollar
credit card payment terminal at checkout,sack-dollar
