text,label
обменять валюту для поездки,baht-sign
Проверить курс тайского бата,baht-sign
Конвертировать доллары в баты,baht-sign
Оплатить в местной валюте,baht-sign
Найти лучший обменник,baht-sign
Обменять деньги перед поездкой в Таиланд,baht-sign
Перевести баты в доллары,baht-sign
Получить тайские баты в аэропорту,baht-sign
Конвертация валюты для путешествия,baht-sign
Проверить сегодняшний курс бата,baht-sign
Перевести деньги в батах,baht-sign
Нужно получить баты перед поездкой,baht-sign
Какой курс обмена бата?,baht-sign
Надо разобраться с валютой для Таиланда,baht-sign
Нужно обменять деньги перед поездкой,baht-sign
Обменять валюту для поедзки,baht-sign
Проверить курс баhта,baht-sign
Конвертировать в местнуу валюту,baht-sign
Получить тайские баты в аэропоурте,baht-sign
Проверить курс доллара,baht-sign
Конвертировать в евро,baht-sign
Перевод долларов в фунты,baht-sign
Отправить деньги за рубеж,baht-sign
Оплатить иностранной валютой,baht-sign
Проверить сегодняшний курс доллара,baht-sign
Конвертация тайского бата для отпуска,baht-sign
