text,label
андроид,mobile
звонок,mobile
сотовый,mobile
сотовый телефон,mobile
устройство,mobile
мобильный,mobile
мобильный телефон,mobile
номер,mobile
телефон,mobile
экран,mobile
телефон,mobile
текст,mobile
смартфон Android,mobile
интерфейс мобильного приложения Android,mobile
позвонить с мобильного телефона,mobile
входящий звонок на сотовый,mobile
сотовый сигнал в мобильной сети,mobile
подключение к вышке сотовой связи,mobile
сотовый телефон в руке,mobile
разбитый экран сотового телефона,mobile
управление мобильными устройствами,mobile
устройство с сенсорным экраном,mobile
мобильное приложение для повседневных задач,mobile
дизайн макета мобильного экрана,mobile
номер мобильного телефона контакт,mobile
мобильный номер сохранённый в контактах,mobile
уведомление телефона на экране,mobile
меню настроек телефона,mobile
время экрана на мобильном телефоне,mobile
экран блокировки на телефоне,mobile
цифровой набор телефонного номера,mobile
история телефонных звонков,mobile
текстовое сообщение на мобильном,mobile
уведомление о тексте на экране,mobile
современный смартфон с сенсорным экраном,mobile
мобильное устройство iPhone или Android,mobile
экран мобильного телефона с иконками приложений,mobile
держать смартфон в портретном режиме,mobile
мобильный телефон для звонков и сообщений,mobile
сотовый с камерой и приложениями,mobile
зарядка аккумулятора мобильного устройства,mobile
экран телефона с уведомлениями,mobile
SMS текстовое сообщение на сотовом,mobile
макет дизайна мобильного интерфейса,mobile
Мне нужна иконка мобильного телефона для экрана контактов,mobile
добавить символ смартфона в раздел устройств,mobile
показать сотовый для функции истории звонков,mobile
использовать иконку мобильного для поля номера телефона,mobile
мобилный телефон,mobile
сотовй телефон звонок,mobile
смартофн устройство,mobile
номер телфона контакт,mobile
стационарный телефон на столе,mobile
планшетный компьютер с большим экраном,mobile
умные часы на запястье,mobile
ноутбук портативный компьютер,mobile
рация радиосвязь,mobile
дисковый телефон старинный,mobile
