text,label
постройка,garage
починить машину в гараже,garage
поставить машину в гараж,garage
выгнать машину из гаража,garage
открыть дверь гаража,garage
заменить привод гаражной двери,garage
организовать хранение в гараже,garage
использовать гараж как дополнительное место хранения,garage
построить гараж,garage
укрепить конструкцию гаража,garage
превратить гараж в мастерскую,garage
использовать гараж как склад,garage
покрыть пол гаража эпоксидкой,garage
установить стеллажи в гараже,garage
поставить обе машины в гараж,garage
использовать гараж для домашнего спортзала,garage
почистить гараж,garage
парковаться в гараже,garage
сломалась дверь гаража,garage
гаражная мастерская,garage
убрать в гараже,garage
починить гаражную дверь,garage
организовать гараж,garage
припарковать машину на подъездной дорожке,garage
хранить вещи в складе self-storage,garage
ремонтировать машину в автосервисе,garage
парковаться на подземной стоянке,garage
использовать навес вместо гаража,garage
организовать хранение в подвале,garage
гараж,garage
парковка,garage
мастерская,garage
машина в безопасности в гараже на ночь,garage
загнать машину в гараж,garage
гаражные ворота открываются автоматически,garage
гараж на одну машину при доме,garage
гараж на две машины с полками для хранения,garage
мастерская в гараже с инструментами на стене,garage
обустроить мастерскую в гараже,garage
спортзал в переоборудованном гараже,garage
иконка гаража для приложения умного дома,garage
гараж с верстаком и перфорированной панелью,garage
поставить велосипед в гараж,garage
сигнал датчика гаража когда ворота открыты,garage
умный привод гаражных ворот на телефоне,garage
гараж заставлен коробками при переезде,garage
освободить гараж для машины,garage
пульт от гаражных ворот на козырьке,garage
проект выходного дня в мастерской гаража,garage
нужна иконка гаража для домашнего приложения,garage
добавить символ гаража в раздел парковки,garage
показать гараж для функции домашнего хранения,garage
использовать иконку гаража на экране хранения транспорта,garage
гаражные ворота открываются,garage
гараж с верстаком,garage
поставить машину в гараж на ночь,garage
умные ворота гаража,garage
инструменты в мастерской гаража,garage
