text,label
auto,steering-wheel
car,steering-wheel
direction,steering-wheel
driving,steering-wheel
navigation,steering-wheel
auto steering wheel interior,steering-wheel
luxury auto steering wheel controls,steering-wheel
car steering wheel grip,steering-wheel
sports car steering wheel design,steering-wheel
direction change via steering wheel,steering-wheel
steering wheel turn direction,steering-wheel
driving lesson steering wheel,steering-wheel
hands on steering wheel driving,steering-wheel
navigation screen on steering wheel,steering-wheel
in-car navigation controls,steering-wheel
leather wrapped car steering wheel,steering-wheel
racing wheel with flat bottom design,steering-wheel
airbag center of steering wheel,steering-wheel
horn button on steering wheel,steering-wheel
cruise control buttons on wheel,steering-wheel
heated steering wheel luxury car,steering-wheel
ergonomic steering wheel grip,steering-wheel
steering column tilt and telescoping,steering-wheel
race car driver gripping wheel,steering-wheel
go-kart small steering wheel,steering-wheel
I need a steering wheel icon for the driving section,steering-wheel
add a wheel symbol to the car navigation feature,steering-wheel
show a steering wheel for the auto category,steering-wheel
use the steering wheel icon for the driver mode,steering-wheel
sterring wheel car,steering-wheel
driivng wheel auto,steering-wheel
car stering column,steering-wheel
naviagtion wheel,steering-wheel
gear shift stick inside car console,steering-wheel
pedals accelerator brake clutch,steering-wheel
dashboard speedometer and gauges,steering-wheel
car seat belt safety buckle,steering-wheel
rearview mirror inside car,steering-wheel
joystick game controller directional,steering-wheel
