text,label
направление,steering-wheel
вождение,steering-wheel
рулевое колесо авто интерьер,steering-wheel
роскошное авто рулевое колесо кнопки,steering-wheel
руль автомобиля хват,steering-wheel
спортивный автомобиль рулевое колесо,steering-wheel
смена направления рулём,steering-wheel
поворот руля смена курса,steering-wheel
урок вождения рулевое колесо,steering-wheel
руки на руле вождение,steering-wheel
навигационный экран на руле,steering-wheel
органы управления навигацией в авто,steering-wheel
кожаный руль автомобиля,steering-wheel
гоночный руль с плоским нижним краем,steering-wheel
подушка безопасности в центре руля,steering-wheel
кнопка клаксона на руле,steering-wheel
кнопки круиз-контроля на руле,steering-wheel
подогреваемый руль в люксовом авто,steering-wheel
эргономичный хват руля,steering-wheel
рулевая колонка наклон и регулировка,steering-wheel
гонщик держит руль,steering-wheel
маленький руль карта,steering-wheel
нужна иконка руля для раздела вождения,steering-wheel
добавь символ руля к навигационной функции авто,steering-wheel
покажи руль для категории автомобилей,steering-wheel
используй иконку руля для режима водителя,steering-wheel
рулевое колесо атомобиля,steering-wheel
колесо вождения авто,steering-wheel
рулевая колонка машины,steering-wheel
навигционный руль,steering-wheel
рычаг переключения передач в консоли авто,steering-wheel
педали газ тормоз сцепление,steering-wheel
приборная панель спидометр,steering-wheel
ремень безопасности пряжка,steering-wheel
зеркало заднего вида в авто,steering-wheel
джойстик игровой контроллер направление,steering-wheel
