text,label
бикини,bra
бюстгальтер,bra
брасьер,bra
плавание,bra
верх от бикини для пляжа,bra
комплект бикини для летнего отпуска,bra
примерка бюстгальтера в магазине белья,bra
размер бюстгальтера измерили для поддержки,bra
брасьер с косточками для лучшей поддержки,bra
брасьер стирают с деликатным уходом,bra
верх купальника с встроенной поддержкой,bra
категория купальников в fashion app,bra
бюстгальтер с двумя чашками и регулируемыми бретелями,bra
иконка bra для clothing app,bra
спортивный бра на тренировке,bra
бюстгальтер на косточках держит форму,bra
бра висит на сушилке после стирки,bra
верх купальника для пляжной одежды,bra
гайд по размеру бра в shopping app,bra
бюстгальтер без бретелей под вечернее платье,bra
иконка bra для женской одежды,bra
мягкий бра для повседневной носки,bra
нужна иконка bra для fashion app,bra
добавить символ bra в раздел нижнего белья,bra
показать bra в категории женской одежды,bra
использовать иконку bra для раздела swimwear,bra
спортивный бра на тренировке,bra
примерка бюстгальтера в магазине,bra
брасьер с косточками для поддержки,bra
верх купальника для пляжного сезона,bra
трусики сложены в ящике,bra
слитный купальник как цельный swim garment,bra
майка без рукавов на каждый день,bra
рубашка как верхняя одежда,bra
низ бикини в комплекте с верхом,bra
платье для торжественного случая,bra
