text,label
bucket,popcorn
junk food,popcorn
kernels,popcorn
popcor,popcorn
popcorn,popcorn
large bucket of salted popcorn,popcorn
buttery popcorn fresh from the microwave,popcorn
extra butter on movie popcorn,popcorn
corn kernels popped in hot oil,popcorn
corn-based movie snack,popcorn
classic junk food at the movies,popcorn
junk food for watching films,popcorn
unpopped kernels at the bottom of the bag,popcorn
popped kernels in a red bucket,popcorn
movie night popcorn snack,popcorn
movie theater popcorn smell,popcorn
popcor snack for film night,popcorn
hot popcor straight from the machine,popcorn
popcorn in a striped bag,popcorn
hot buttered popcorn,popcorn
snack food for cinema trips,popcorn
light snack to munch during movies,popcorn
theater concession stand popcorn,popcorn
movie theater classic treat,popcorn
classic red and white striped popcorn bucket,popcorn
freshly popped corn with butter drizzle,popcorn
cinema snack served in paper bag,popcorn
microwave popcorn bag puffed up,popcorn
salted caramel popcorn for movie nights,popcorn
concession stand popcorn with extra butter,popcorn
fluffy white popped corn kernels,popcorn
sweet kettle corn variety at the fair,popcorn
overflowing bucket of movie theater popcorn,popcorn
childhood snack food memories at the cinema,popcorn
popocorn movie snack,popcorn
popcron bucket at the theater,popcorn
popcorn theaer snack,popcorn
buttery popcrn for movies,popcorn
butter,popcorn
corn,popcorn
movie,popcorn
snack,popcorn
theater,popcorn
need to book bucket,popcorn
need to book butter,popcorn
need to book corn,popcorn
need to book junk food,popcorn
need to book kernels,popcorn
need to book movie,popcorn
need to book popcor,popcorn
need to book popcorn,popcorn
need to book snack,popcorn
need to book theater,popcorn
bucket after work,popcorn
butter after work,popcorn
corn after work,popcorn
junk food after work,popcorn
kernels after work,popcorn
movie after work,popcorn
popcor after work,popcorn
