text,label
camper,caravan
motor home,caravan
rv,caravan
trailer,caravan
Camper van trip this summer,caravan
Motor home rental for the vacation,caravan
RV park reservation for the weekend,caravan
Trailer hookup before departure,caravan
Road travel in the caravan,caravan
Book an RV for the national park trip,caravan
Caravan holiday along the coast,caravan
Pack the camper van for the weekend,caravan
Find an RV campsite nearby,caravan
Caravan service before the long trip,caravan
Motorhome route planning,caravan
Load up the trailer for the camping trip,caravan
Caravan park check-in time,caravan
Family road trip in the RV,caravan
Caravan storage after the season,caravan
living the van life this summer,caravan
packed the RV and ready to go,caravan
caravan spots fill up fast,caravan
doing the whole trip in the camper,caravan
carvan holiday along the coast,caravan
rv campsite resevation,caravan
motorhome roote planning,caravan
camper van servce before the trip,caravan
Tent camping at the national park,caravan
City bus tour of the area,caravan
Cargo trailer hitched to the car,caravan
Hotel booking for the vacation,caravan
Cabin rental in the woods,caravan
Bicycle touring route this summer,caravan
Camper van supplies shopping list,caravan
Motor home check-in at the campsite,caravan
RV awning repair before the trip,caravan
Trailer hitch installed on the tow vehicle,caravan
Travel route planned for the caravan trip,caravan
