text,label
desktop computer,desktop
imac,desktop
pc,desktop
Set up the computer at home,desktop
Repair the computer,desktop
Upgrade the CPU for better performance,desktop
Replace the CPU,desktop
Clean up the desktop,desktop
Organize the desktop icons,desktop
Buy a new desktop computer,desktop
Connect a new device to the network,desktop
Set up the device,desktop
Get a new iMac for the studio,desktop
Set up the iMac at work,desktop
Repair the machine,desktop
Service the machine regularly,desktop
Adjust the monitor brightness,desktop
Position the monitor ergonomically,desktop
Build a gaming PC,desktop
Set up the new PC,desktop
Clean the screen,desktop
Replace the cracked screen,desktop
Set up the iMac on the desk,desktop
Buy a new desktop computer for work,desktop
Upgrade the RAM in the desktop,desktop
Install software on the desktop PC,desktop
Clean the monitor screen,desktop
Connect an external monitor,desktop
Back up data from the desktop,desktop
Replace the old desktop with a new one,desktop
Configure the display settings,desktop
Set up the home office desktop,desktop
New iMac day,desktop
Desktop upgrade,desktop
Set up the PC,desktop
New screen,desktop
set up the desktpo computer,desktop
by a new imac,desktop
clen the monitr screen,desktop
upgarde the pc,desktop
