text,label
устройство,tablet
Киндл,tablet
экран,tablet
планшет на столе,tablet
портативное планшетное устройство,tablet
электронная книга Kindle планшет,tablet
планшет Kindle Fire чтение,tablet
сенсорный экран планшета,tablet
большой экран планшетного устройства,tablet
iPad планшет с сенсорным дисплеем,tablet
Android планшет просматривает интернет,tablet
планшет в горизонтальном режиме для видео,tablet
стилус для рисования на планшете,tablet
чехол для планшета с клавиатурой,tablet
чтение книги на планшете ночью,tablet
планшет на настольной подставке,tablet
ребёнок использует планшет для обучения,tablet
разделённый экран планшета многозадачность,tablet
пожилой человек использует большой планшет,tablet
нужна иконка планшета для категории устройств,tablet
добавь символ планшета в параметры размера экрана,tablet
покажи планшет для функции приложения чтения,tablet
используй иконку планшета для раздела мобильных устройств,tablet
планшнт устройство экран,tablet
Киндел планшет чтение,tablet
экарн планшет,tablet
планшнт iPad,tablet
смартфон мобильный телефон маленький экран,tablet
ноутбук компьютер клавиатура экран,tablet
настольный компьютер монитор большой,tablet
электронная книга Kindle Paperwhite,tablet
блокнот письменная бумага дневник,tablet
телевизор большой экран на стене,tablet
