text,label
beard,mustache
hair,mustache
lumberjack,mustache
shave,mustache
walrus,mustache
whiskers,mustache
thick beard and mustache combo,mustache
beard icon for a barber or grooming app,mustache
face with a handlebar mustache,mustache
face hair icon in a character customization screen,mustache
facial hair styled into a twirled mustache,mustache
hair icon for a barber shop menu,mustache
bushy lumberjack mustache with a beard,mustache
lumberjack style facial hair,mustache
shave off the mustache for a new look,mustache
shave styling kit for mustache grooming,mustache
walrus-style drooping mustache,mustache
thick walrus mustache hanging over the lip,mustache
long whiskers of a twirled mustache,mustache
waxed whiskers curling at the ends,mustache
curly handlebar mustache on a white background,mustache
grow a mustache for Movember awareness,mustache
barber shop icon for a grooming or hairstyle app,mustache
thick dark mustache sitting above the upper lip,mustache
style a mustache with wax for a sharp curl,mustache
facial hair category in a character creator app,mustache
classic pencil-thin mustache in a silhouette,mustache
mustache disguise prop for a photo booth app,mustache
men's grooming icon for a shaving products app,mustache
bushy full mustache covering the upper lip,mustache
mustahce waxed for a curl,mustache
mustace grooming kit,mustache
moustahce style for Movember,mustache
mustche trimmed neatly,mustache
face,mustache
mustache,mustache
need to return beard,mustache
need to return face,mustache
need to return hair,mustache
need to return lumberjack,mustache
need to return shave,mustache
need to return walrus,mustache
need to return whiskers,mustache
need to return mustache,mustache
remember to return beard,mustache
remember to return face,mustache
remember to return hair,mustache
remember to return lumberjack,mustache
remember to return shave,mustache
remember to return walrus,mustache
remember to return whiskers,mustache
remember to return mustache,mustache
beard on Monday,mustache
face on Monday,mustache
hair on Monday,mustache
lumberjack on Monday,mustache
shave on Monday,mustache
walrus on Monday,mustache
whiskers on Monday,mustache
mustache on Monday,mustache
