text,label
frost,snowman
frosty,snowman
snowman,snowman
cold winter day perfect for building a snowman,snowman
cold weather icon for a weather forecast app,snowman
snowman decoration in a holiday window display,snowman
yard decoration snowman with a scarf and hat,snowman
frost on the ground the morning after a snowstorm,snowman
frosty the snowman standing in the yard,snowman
frosty snowman with coal eyes and a carrot nose,snowman
frosty winter icon for a holiday greeting card,snowman
holiday snowman decoration for Christmas,snowman
winter holiday icon in a seasonal app,snowman
snow packed into a round snowman body,snowman
snow covering the ground on a winter morning,snowman
build a snowman with the kids after school,snowman
three stacked snowballs making a classic snowman,snowman
build a snowman after a heavy snowfall,snowman
winter holiday icon for a seasonal or Christmas app,snowman
snowman with a carrot nose and coal buttons,snowman
snowman wearing a scarf and top hat outside,snowman
festive decoration icon for a holiday app,snowman
cheerful snowman with stick arms and a smile,snowman
children rolling snowballs to build a snowman,snowman
winter season icon in a weather or calendar app,snowman
glowing snowman ornament on a snowy lawn,snowman
snowmaan wearing a top hat,snowman
snoman standing in the yard,snowman
snowamn built in the yard,snowman
snoaman with a carrot nose,snowman
cold,snowman
decoration,snowman
holiday,snowman
snow,snowman
snowman without snow,snowman
remember to replace cold,snowman
remember to replace decoration,snowman
remember to replace frost,snowman
remember to replace frosty,snowman
remember to replace holiday,snowman
remember to replace snow,snowman
remember to replace snowman,snowman
remember to replace snowman without snow,snowman
cold appointment,snowman
decoration appointment,snowman
frost appointment,snowman
frosty appointment,snowman
holiday appointment,snowman
snow appointment,snowman
snowman appointment,snowman
snowman without snow appointment,snowman
replace cold online,snowman
replace decoration online,snowman
replace frost online,snowman
replace frosty online,snowman
replace holiday online,snowman
replace snow online,snowman
replace snowman online,snowman
replace snowman without snow online,snowman
weekly cold,snowman
