text,label
change,swap
merge,swap
route,swap
swap arrows pointing opposite directions,swap
two arrows swap icon,swap
change order swap positions,swap
change and swap items,swap
merge two streams into one,swap
merge lanes traffic arrows,swap
move item from one place to another,swap
move and swap columns,swap
route changed alternate path,swap
swap route navigation,swap
transfer funds between accounts,swap
data transfer swap,swap
swap two items left and right arrows,swap
currency exchange swap rates,swap
swap team members in lineup,swap
photo editor swap foreground background,swap
swap SIM card between phones,swap
language swap source and target,swap
swap columns in spreadsheet,swap
toggle swap between two views,swap
drag and drop swap positions,swap
swap filter options A and B,swap
show swap arrows for the toggle view,swap
swpa arrows icon,swap
curency swap exchange,swap
tranfer swap items,swap
merg and swap,swap
