text,label
lodging,bed-bunk
mattress,bed-bunk
rest,bed-bunk
siblings,bed-bunk
sleep,bed-bunk
sleepover,bed-bunk
travel,bed-bunk
bed,bed-bunk
bunk,bed-bunk
bed bunk,bed-bunk
lodging para los niños,bed-bunk
mattress para los niños,bed-bunk
rest para los niños,bed-bunk
siblings para los niños,bed-bunk
sleep para los niños,bed-bunk
sleepover para los niños,bed-bunk
travel para los niños,bed-bunk
bed para los niños,bed-bunk
bunk para los niños,bed-bunk
bed bunk para los niños,bed-bunk
lodging después del trabajo,bed-bunk
mattress después del trabajo,bed-bunk
rest después del trabajo,bed-bunk
siblings después del trabajo,bed-bunk
sleep después del trabajo,bed-bunk
sleepover después del trabajo,bed-bunk
travel después del trabajo,bed-bunk
bed después del trabajo,bed-bunk
bunk después del trabajo,bed-bunk
bed bunk después del trabajo,bed-bunk
lodging el lunes,bed-bunk
mattress el lunes,bed-bunk
rest el lunes,bed-bunk
siblings el lunes,bed-bunk
sleep el lunes,bed-bunk
sleepover el lunes,bed-bunk
travel el lunes,bed-bunk
bed el lunes,bed-bunk
bunk el lunes,bed-bunk
bed bunk el lunes,bed-bunk
pedir lodging en línea,bed-bunk
pedir mattress en línea,bed-bunk
pedir rest en línea,bed-bunk
pedir siblings en línea,bed-bunk
pedir sleep en línea,bed-bunk
pedir sleepover en línea,bed-bunk
pedir travel en línea,bed-bunk
pedir bed en línea,bed-bunk
pedir bunk en línea,bed-bunk
pedir bed bunk en línea,bed-bunk
nuevo lodging,bed-bunk
nuevo mattress,bed-bunk
nuevo rest,bed-bunk
nuevo siblings,bed-bunk
nuevo sleep,bed-bunk
siblinsg para los niños,bed-bunk
bed bunk para los nios,bed-bunk
bunk despuués del trabajo,bed-bunk
bed bnuk el lunes,bed-bunk
loddging después del trabajo,bed-bunk
