text,label
Pocket Calculator,calculator
abacus,calculator
addition,calculator
arithmetic,calculator
counting,calculator
multiplication,calculator
subtraction,calculator
Pocket calculator for quick sums,calculator
Abacus alternative digital calculator,calculator
Addition of the monthly expenses,calculator
Arithmetic check on the invoice,calculator
Counting items in the inventory,calculator
Math homework help needed,calculator
Multiplication table practice,calculator
Subtraction of the discounts,calculator
Calculate the total before checkout,calculator
Split the bill on the calculator,calculator
Use the calculator app for taxes,calculator
Quick math for the shopping budget,calculator
Tip calculator at the restaurant,calculator
Loan repayment calculation,calculator
Calculate the discount amount,calculator
Simple sums on the calculator,calculator
Scientific calculator for the exam,calculator
Unit conversion calculation,calculator
just plug it into the calculator,calculator
let me crunch the numbers quick,calculator
calculator says that's way over budget,calculator
doing the math in my head,calculator
caluculator for the tax return,calculator
matth homework with the calculater,calculator
arithmatic problem to solve,calculator
calclate the total price,calculator
Pocket calculator batteries replaced,calculator
Abacus and calculator both on the desk,calculator
Column addition for the budget spreadsheet,calculator
Arithmetic skills refresher course,calculator
Counting on fingers won't cut it here,calculator
Math tutoring session booked for Tuesday,calculator
Multiplication practice for the kids,calculator
Subtraction from the total account balance,calculator
