text,label
calendar,calendar
calendar-o,calendar
event,calendar
month,calendar
tear-off calendar,calendar
when,calendar
year,calendar
Check the calendar for free slots,calendar
Old calendar-style planner,calendar
Pick a date for the meeting,calendar
Day planner update,calendar
Event on the calendar this week,calendar
Monthly overview at a glance,calendar
Schedule the dentist appointment,calendar
Tear-off calendar for the kitchen,calendar
Time management calendar review,calendar
When is the next holiday,calendar
Year planner on the wall,calendar
Check availability on the calendar,calendar
Block time for the project,calendar
Add the flight to the calendar,calendar
Monthly calendar reset,calendar
Family calendar for the school year,calendar
Calendar invite for the team,calendar
Mark the vacation on the calendar,calendar
Upcoming deadlines on the calendar,calendar
Sync calendar with the team,calendar
Annual leave planner update,calendar
what's on the calendar tomorrow,calendar
blocked that out on my calendar,calendar
can you check the calendar for me,calendar
nothing on the calendar this week,calendar
calender reminder for the meeting,calendar
shedule the appoitment,calendar
add to the calander for next week,calendar
montly review on the calender,calendar
Calendar synced across all devices,calendar
Classic paper calendar on the wall,calendar
Date night planned for next Friday,calendar
Day off request submitted for Monday,calendar
Event added to the shared team calendar,calendar
Monthly budget review on the first,calendar
Schedule confirmed for the new quarter,calendar
Tear-off page ripped — new day starts,calendar
Time blocked for deep work this afternoon,calendar
When is the next public holiday,calendar
Year-end review calendar prepared,calendar
