text,label
financial,coins
Exchange currency at the airport,coins
Check the currency exchange rate,coins
Find a dime on the sidewalk,coins
Save every dime,coins
Review financial reports,coins
Plan the financial budget,coins
Buy gold coins as an investment,coins
Check gold prices today,coins
Save money for vacation,coins
Track daily money spending,coins
Find a lucky penny,coins
Count the pennies in the jar,coins
Upgrade to premium membership,coins
Get premium access to the app,coins
Save loose change in a jar,coins
Count coins from the piggy bank,coins
Pay for parking with coins,coins
Sort coins by denomination,coins
Give kids their weekly allowance,coins
Check the change from the store,coins
Roll coins to deposit at the bank,coins
Save up coins for something special,coins
Collect foreign coins from travels,coins
Counting my coins,coins
Save every penny,coins
Check my change,coins
Piggy bank time,coins
save som money,coins
exchagne currency for trip,coins
count the conis,coins
finanical planning session,coins
count a pile of coins,coins
save loose change in a jar,coins
roll coins for the bank,coins
collect spare coins for laundry,coins
sort coins by value,coins
count spare change before the trip,coins
