text,label
discount,tag
labe,tag
label,tag
price,tag
discount tag sale percentage off,tag
clearance discount price tag,tag
label tag on clothing item,tag
label on product tag,tag
label tag for organizing,tag
label tag name identifier,tag
price tag on merchandise,tag
price tag retail store,tag
shopping tag attached to bag,tag
shopping price tag product,tag
price tag hanging from clothing item,tag
sale tag red discount label,tag
luggage tag name and address,tag
product tag barcode label,tag
digital tag for categorizing notes,tag
gift tag tied with ribbon,tag
tag management in content system,tag
keyword tag for search indexing,tag
clearance sale tag yellow,tag
security tag on retail clothing,tag
pric tag discount,tag
labl on product,tag
discoun tag sale,tag
shoping tag item,tag
