text,label
kiss,lips
lips,lips
lipstick,lips
smile,lips
lips as a fashion beauty icon,lips
fashion lipstick on the lips,lips
kiss lips symbol,lips
red lips icon,lips
lips with lipstick applied,lips
lipstick on the lips,lips
lips painted with red lipstick,lips
mouth and lips together,lips
lips as the mouth symbol,lips
smile on the lips,lips
lips forming a wide smile,lips
bright red lips with lipstick,lips
lip gloss on the full lips,lips
beauty brand lips logo,lips
pink lips in the makeup app,lips
lips emoji for a flirty message,lips
lip print on the love letter,lips
cosmetics ad featuring full red lips,lips
lips forming a wide smile,lips
lip sync performance on the stage,lips
I need a lips icon for the beauty app,lips
add a kiss symbol to the messages feature,lips
show lips for the makeup category,lips
use the lips icon for the lip sync feature,lips
lipsitck on lips,lips
beuaty lips icon,lips
red lps with lipstick,lips
ksis lips symbol,lips
