text,label
автоматический,lasso-sparkles
выбрать,lasso-sparkles
Используйте автоматическое выделение в Photoshop,lasso-sparkles
Применить автоматическое удаление фона,lasso-sparkles
Используйте инструмент «Волшебная палочка»,lasso-sparkles
Примените волшебный эффект к дизайну,lasso-sparkles
"Используйте лассо, чтобы выбрать область",lasso-sparkles
Используйте инструмент «волшебное выделение» в Photoshop.,lasso-sparkles
Автоматический выбор фона,lasso-sparkles
"Используйте ИИ, чтобы выбрать объект",lasso-sparkles
Применить магическое удаление к фону,lasso-sparkles
Автоматический выбор всех похожих цветов,lasso-sparkles
"Используйте инструмент «Лассо», чтобы обвести контур",lasso-sparkles
Используйте интеллектуальный выбор в приложении для дизайна,lasso-sparkles
Автоматически обрезать объект по фону,lasso-sparkles
Автоматический выбор и удаление фона,lasso-sparkles
Волшебный выбор,lasso-sparkles
Выбор ИИ,lasso-sparkles
Умный выбор,lasso-sparkles
используйте инструмент выбора magci,lasso-sparkles
автоматический выбор фона,lasso-sparkles
применить волшебное средство для удаления,lasso-sparkles
используйте AI для выбора объекта,lasso-sparkles
Используйте обычный инструмент «Лассо»,lasso-sparkles
Выделите вручную с помощью инструмента «Перо»,lasso-sparkles
Обрезать изображение вручную,lasso-sparkles
Используйте инструмент «Ластик»,lasso-sparkles
Используйте инструмент выделения области,lasso-sparkles
Используйте волшебную палочку без блесток,lasso-sparkles
умное выделение,lasso-sparkles
магическое выделение,lasso-sparkles
ИИ-выделение,lasso-sparkles
инструмент умного выбора удаляет фон,lasso-sparkles
ИИ-лассо автоматически выбирает объект,lasso-sparkles
умное лассо обводит контур объекта,lasso-sparkles
выбор объекта одним нажатием в редакторе,lasso-sparkles
автоматически выделить и удалить фон,lasso-sparkles
ИИ мгновенно убирает фон,lasso-sparkles
выделение объекта умным лассо,lasso-sparkles
интеллектуальный выбор по краю объекта,lasso-sparkles
волшебная палочка выбирает похожие пиксели,lasso-sparkles
автоматический выбор объекта в редакторе фото,lasso-sparkles
иконка лассо-искр для функции ИИ-редактирования,lasso-sparkles
нажать чтобы выделить передний план,lasso-sparkles
инструмент умной вырезки для дизайна,lasso-sparkles
выделить объект и удалить фон,lasso-sparkles
нужна иконка ИИ-выбора для фотоприложения,lasso-sparkles
добавить символ умного выделения в инструменты редактирования,lasso-sparkles
показать ИИ-лассо для удаления фона,lasso-sparkles
использовать иконку лассо для умного выбора,lasso-sparkles
автовыделение объекта,lasso-sparkles
волшебная палочка удаление фона,lasso-sparkles
умный инструмент лассо,lasso-sparkles
ИИ-выделение,lasso-sparkles
лассо-искры для редактирования,lasso-sparkles
