text,label
cargo moving truck loaded,truck-moving
moving truck cargo box,truck-moving
inventory moving truck full,truck-moving
moving truck inventory transfer,truck-moving
rental moving truck Uhaul,truck-moving
moving truck rental company,truck-moving
vehicle moving truck large,truck-moving
large vehicle moving furniture,truck-moving
large moving truck on highway,truck-moving
Uhaul truck rental moving day,truck-moving
professional movers loading truck,truck-moving
moving truck parked outside house,truck-moving
box truck furniture delivery,truck-moving
moving truck with ramp lowered,truck-moving
cross country moving truck service,truck-moving
electric moving truck fleet,truck-moving
moving truck reservation booking,truck-moving
full moving truck ready to go,truck-moving
moivng truck rental,truck-moving
carogo moving truck,truck-moving
vehicel moving day,truck-moving
trcuk moving furniture,truck-moving
moving truck,truck-moving
U-Haul,truck-moving
box truck,truck-moving
moving van,truck-moving
rent a moving truck for Saturday,truck-moving
return the rental truck by noon,truck-moving
load the furniture into the moving truck,truck-moving
reserve a U-Haul for the move,truck-moving
drive the moving truck to the new place,truck-moving
unload the moving truck at the new apartment,truck-moving
fill up the moving truck with gas before returning,truck-moving
get the moving truck insurance,truck-moving
pick up the rental truck in the morning,truck-moving
check the moving truck for scratches before driving,truck-moving
moving truck reservation for next Friday,truck-moving
U-Haul pickup at 8am Saturday morning,truck-moving
moving truck big enough for the whole apartment,truck-moving
truck rental for the cross town move,truck-moving
friends helping load the moving truck at ten,truck-moving
moving truck parked on the street overnight,truck-moving
return the moving truck after unloading Sunday,truck-moving
gas receipt for the moving truck rental,truck-moving
rent truck,truck-moving
load truck,truck-moving
U-Haul Saturday,truck-moving
return truck,truck-moving
moving truck gas,truck-moving
need to book the moving truck soon,truck-moving
the moving truck is huge should be enough,truck-moving
forgot to reserve the rental truck,truck-moving
how much does a moving truck cost for one day,truck-moving
the moving truck barely fit in the driveway,truck-moving
rnet a moving trcuk Saturday,truck-moving
retrun the rentl truck,truck-moving
load furnituer into the trcuk,truck-moving
reserv a U-Haul for movign,truck-moving
