text,label
protection,umbrella
rain,umbrella
storm,umbrella
wet,umbrella
umbrella for protection from the rain,umbrella
sun protection umbrella on the beach,umbrella
rain umbrella opened on a rainy day,umbrella
carry a rain umbrella just in case,umbrella
storm umbrella blown inside out in the wind,umbrella
stormy weather icon with an umbrella,umbrella
stay dry and avoid getting wet with an umbrella,umbrella
wet streets require an umbrella,umbrella
open umbrella with a curved wooden handle,umbrella
open your umbrella before stepping into the rain,umbrella
weather icon for a rain or forecast app,umbrella
dome-shaped canopy of a brightly colored umbrella,umbrella
compact travel umbrella folded into a sleeve,umbrella
rainy day icon in a calendar or weather widget,umbrella
umbrella with raindrops falling around it,umbrella
share an umbrella with a friend in the rain,umbrella
outdoor event icon with protection from the weather,umbrella
striped umbrella tilted against the wind,umbrella
I need an umbrella icon for my weather app,umbrella
add an umbrella symbol to the rain forecast section,umbrella
show an umbrella for the bad weather reminder,umbrella
use the umbrella icon for the storm alert feature,umbrella
unbrella opened in the rain,umbrella
umbrelal in the storm,umbrella
umbrela for rainy days,umbrella
umrella blown inside out,umbrella
yellow raincoat with a hood pulled up,umbrella
waterproof rain jacket for stormy weather,umbrella
dark storm cloud with rain falling below,umbrella
weather icon showing heavy rain showers,umbrella
beach parasol with colorful stripes in the sand,umbrella
patio umbrella over a garden table and chairs,umbrella
