text,label
grate,manhole
sewer,manhole
metal grate on street surface,manhole
drain grate covering manhole,manhole
sewer system underground access,manhole
sewer manhole cover in city,manhole
circular iron manhole cover on road,manhole
city street infrastructure access point,manhole
underground utility access hatch,manhole
sewer inspection cover with pattern,manhole
heavy cast iron manhole lid,manhole
workers lifting a manhole cover,manhole
storm drain grate on sidewalk,manhole
urban infrastructure maintenance hatch,manhole
sewage system entry point,manhole
round metal disc covering underground pipes,manhole
manhoel cover,manhole
sewre grate,manhole
mnahhole lid,manhole
sewer manholle,manhole
cast iron manhole cover with ribbed pattern,manhole
round sewer access lid on asphalt,manhole
utility manhole in city pavement,manhole
inspection hatch for underground pipes,manhole
public works crew opening a manhole,manhole
drainage access point beneath the street,manhole
steel lid over a sewer chamber,manhole
storm drain cover embossed with city logo,manhole
open manhole with safety cone around it,manhole
underground service chamber entry cover,manhole
manhole cover in need of replacement,manhole
corrugated iron disk set flush in road,manhole
city crew lifting the manhole lid to inspect,manhole
sewer access hatch with bolt fasteners,manhole
road surface broken around an old manhole,manhole
manhole cover icon for infrastructure map,manhole
utility access point in pavement,manhole
drain cover on a wet city street,manhole
underground maintenance hatch symbol,manhole
circular iron lid for sewer inspection,manhole
add a sewer hatch to the underground map view,manhole
show a manhole cover in the infrastructure section,manhole
manhoel cover on wet roard,manhole
sewre acces hatch,manhole
manhole,manhole
grate this weekend,manhole
sewer this weekend,manhole
manhole this weekend,manhole
replace the grate,manhole
replace the sewer,manhole
replace the manhole,manhole
grate after work,manhole
sewer after work,manhole
manhole after work,manhole
remember to replace grate,manhole
remember to replace sewer,manhole
remember to replace manhole,manhole
replace grate,manhole
replace sewer,manhole
replace manhole,manhole
