text,label
валюта,rupiah-sign
символ индонезийской рупии,rupiah-sign
знак рупии для индонезийского рынка,rupiah-sign
символ индонезийской рупии Rp в тексте,rupiah-sign
цена в индонезийских рупиях,rupiah-sign
знак рупии в электронной торговле для Индонезии,rupiah-sign
обменный курс USD/IDR рупия,rupiah-sign
оплата в рупиях на индонезийской кассе,rupiah-sign
зарплата в индонезийских рупиях,rupiah-sign
символ рупии на экране банковской транзакции,rupiah-sign
конвертер валют показывает IDR рупию,rupiah-sign
бюджет в индонезийских рупиях для путешествия,rupiah-sign
знак индонезийской рупии на ценнике магазина,rupiah-sign
мне нужна иконка знака рупии для цен в Индонезии,rupiah-sign
добавь символ рупии в выбор валюты,rupiah-sign
покажи знак рупии для отображения цены в IDR,rupiah-sign
используй иконку рупии для индонезийских платежей,rupiah-sign
символ индонезийокй рупии,rupiah-sign
знак рупии для индонезийсокго рынка,rupiah-sign
обменный курс USD/IDR рупих,rupiah-sign
оплата в индонезийских рупияхе,rupiah-sign
символ индийской рупии INR,rupiah-sign
символ доллара для валюты США,rupiah-sign
знак евро для европейской валюты,rupiah-sign
знак рубля для российской валюты,rupiah-sign
знак иены для японской валюты JPY,rupiah-sign
монета общей валюты с символом доллара,rupiah-sign
