text,label
символ индонезийской рупии,rupiah-sign
знак рупии для индонезийского рынка,rupiah-sign
символ индонезийской рупии Rp в тексте,rupiah-sign
цена в индонезийских рупиях,rupiah-sign
знак рупии в электронной торговле для Индонезии,rupiah-sign
обменный курс USD/IDR рупия,rupiah-sign
оплата в рупиях на индонезийской кассе,rupiah-sign
зарплата в индонезийских рупиях,rupiah-sign
символ рупии на экране банковской транзакции,rupiah-sign
конвертер валют показывает IDR рупию,rupiah-sign
бюджет в индонезийских рупиях для путешествия,rupiah-sign
знак индонезийской рупии на ценнике магазина,rupiah-sign
цены для Индонезии в рупиях,rupiah-sign
выбор валюты IDR,rupiah-sign
отображение цены в IDR,rupiah-sign
индонезийские платежи в рупиях,rupiah-sign
символ индонезийокй рупии,rupiah-sign
знак рупии для индонезийсокго рынка,rupiah-sign
обменный курс USD/IDR рупих,rupiah-sign
оплата в индонезийских рупияхе,rupiah-sign
символ индийской рупии INR,rupiah-sign
символ IDR на цене товара,rupiah-sign
цена для Индонезии указана в рупиях,rupiah-sign
итог в счёте указан в индонезийских рупиях,rupiah-sign
знак иены для японской валюты JPY,rupiah-sign
монета общей валюты с символом доллара,rupiah-sign
Показать итог заказа в IDR,rupiah-sign
Переключить цены магазина на рупии,rupiah-sign
Оплатить поставщику в индонезийских рупиях,rupiah-sign
Обменять дорожные наличные на IDR,rupiah-sign
Показать зарплату в индонезийских рупиях,rupiah-sign
Запланировать бюджет поездки на Бали в IDR,rupiah-sign
