text,label
кровь,droplet
цвет,droplet
капля,droplet
капелька,droplet
пот,droplet
капля воды,droplet
капля крови после прокола пальца,droplet
капля крови для анализа,droplet
холодная капля воды на стекле,droplet
холодная капля падает из крана,droplet
цветовая пипетка для выбора цвета,droplet
цветная капля в инструменте дизайна,droplet
комиксная капля пота на лице,droplet
комиксная капля как символ удивления,droplet
капля воды на листе,droplet
капля падает из крана,droplet
капля воды на поверхности,droplet
одна капля в воздухе,droplet
капля дождя падает с неба,droplet
капля дождя падает в лужу,droplet
капля пота на лбу,droplet
капля пота после тренировки,droplet
капля воды на оконном стекле,droplet
капля воды скатывается по стеклу,droplet
падение одной капли воды,droplet
капля дождя на луже,droplet
капля пота после тяжёлой тренировки,droplet
капля крови для медицинского осмотра,droplet
капля воды на зелёном листе,droplet
капля выбора цвета в приложении дизайна,droplet
капля росы на утренней траве,droplet
значок капли для воды и гидратации,droplet
слеза падает из глаза,droplet
капля чернил падает в воду,droplet
добавить каплю воды в раздел погоды,droplet
показать каплю для инструмента выбора цвета,droplet
использовать каплю для индикатора жидкости,droplet
значок дождевой капли,droplet
капля для шкалы увлажнения,droplet
вода капает из крана,droplet
дождевые капли на окне,droplet
капля пота на лице после бега,droplet
кровь для лабораторного теста,droplet
цветная капля краски,droplet
роса на траве утром,droplet
капелька воды для погоды,droplet
blood,droplet
cold,droplet
color,droplet
comic,droplet
drop,droplet
droplet,droplet
raindrop,droplet
sweat,droplet
waterdrop,droplet
blood после работы,droplet
cold после работы,droplet
color после работы,droplet
comic после работы,droplet
drop после работы,droplet
