text,label
буфер обмена,paste
копировать,paste
документ,paste
бумага,paste
вставить из буфера обмена,paste
скопировать и вставить текст,paste
скопировать из документа вставить,paste
вставить в редактор документов,paste
вставить содержимое документа,paste
вставить содержимое бумаги на страницу,paste
вырезать скопировать вставить,paste
буфер обмена с бумагой показывающей вставку,paste
скопировать текст и вставить в новое поле,paste
горячая клавиша вставки Ctrl+V,paste
редактор документов вставка из буфера,paste
иконка буфера обмена со стрелкой вставки,paste
тройка действий вырезать скопировать вставить,paste
вставка фрагмента кода из буфера обмена,paste
вставить изображение из буфера копирования,paste
ярлык вставки в мобильном редакторе,paste
действие вставки в текстовом процессоре,paste
Мне нужна иконка вставки для редактора документов,paste
добавить кнопку вставки из буфера на панель инструментов,paste
показать символ вставки для функции копирования-вставки,paste
использовать иконку вставки для действия ввода текста,paste
буфер обменаа вставка,paste
копироваьт и вставить,paste
встаивть текст,paste
буфер обема копия,paste
действие копирования для дублирования контента,paste
действие вырезания для удаления и копирования,paste
буфер обмена показывающий скопированный контент,paste
кнопка отмены для отмены вставки,paste
действие найти и заменить,paste
перетащить и отпустить без буфера,paste
