text,label
99 cent price tag,cent-sign
swis franc rate chekc before tirp,chf-sign
coach walked us through it at the board,chalkboard-user
watch a tiny plant grow over time,seedling
fitness watch calories burned,watch-fitness
Set a timer for 20 minutes,clock
conect tablet to speakr,tablet
install a new ceiling light fixture,light-ceiling
TM superscirpt on the product label,trademark
citrus fruit with a bright yellow skin,lemon
rook moved across the open file,chess
circular power button with vertical line through the top,power-off
Lira Sign,lira-sign
dog vacination reminder with shield,shield-dog
swimear bra top for beach season,bra
start a load of laundry,jug-detergent
crew boarding space shuttle before launch,shuttle-space
ski lift or cable car to the top,cable-car
srot rows by daet,table-rows
sugar candy in a glass jar,candy
Get the fireplace going,chimney
pair the speaker with the phone via bluetooth,speaker
signal icon for wifi versus cellular,signal
e-signature captured on a touch screen,signature
observatory dome housing a large telescope,telescope
minibus van passenger,van-shuttle
multi-object selection with bounding box,object-group
Go to the coffee shop to work,coffee-pot
shopping trip this weekend,bags-shopping
patient note,note-medical
speaker,headphones
api endpoint integration,webhook
locked,lock
mtg deck buildign session,cards-blank
side salad served beside main course,salad
coin as money for the piggy bank,coin
Register all new vendor agreements,cabinet-filing
vintage band t-shirt from concert,shirt
yeast,bread-slice
provider note for the patient,note-medical
wrap the pallet for shipping,pallet
violine played in the orchestra,violin
jigsaw puzle spread on table,puzzle
waterspout,tornado
make a looping meme,gif
utilities,meter
church community gathering for holiday events,church
toggle beteen paint and sketching mode,paintbrush-pencil
Found a frog!,frog
barbecue,grill
bicycle trike stable,tricycle-adult
MotoGP racing bike at speed,motorcycle
Check tire pressure on the dashboard,gauge
nasa,shuttle-space
bodega corner shop open late night,shop
software add-on plugin,puzzle
star trek insignia delta shield badge,starship
airply mirroring to Apple TV,screencast
Bathtub drain needs unclogging,bath
living room furniture piece,loveseat
textile,rug
utility trailer home depot rental,trailer
Keep the yolk intact when frying,egg-fried
We need bunk beds for the kids' room,bed-bunk
add a power socket to the home energy feature,outlet
note attached to the chart,note-medical
Late for the bus again,bus
captoin on movie,subtitles
shower,bath
add an invoice symbol to the payments section,receipt
follow a feed for the latest updates,rss
tire rotation service at garage,tire
lockd account icon,lock
portable toilet at the marathon,toilet-portable
lava flowing down the slope at night,volcano
code snippet integration,webhook
manhole cover in need of replacement,manhole
microscope slide with specimen on stage,microscope
fried eggg in the pan,egg-fried
baking in a preheated oven,oven
Join the online meeting with headset,headset
short sleeve casual top,shirt
bugg mosquito,mosquito
Bit cloudy today,clouds-sun
medical book with a red cross on the cover,book-medical
Mask out the background,crop
enter card number at the checkout form,credit-card
pressure gauge dial on the boiler,dial
mystery character behind the mask,mask
swimming,fish
newborn,baby
navigation route on map,map-location
dinning fork knife,utensils
juice squeezed from ripe berries,strawberry
Get a treat from the bakery,cookie
automatic,wand-magic
vegetable icon for a grocery list app,carrot
paste the copied data into the spreadsheet,paste
payment in local pesos,peso-sign
task pending completion,loader
talking through comments on the post,comment
rental truck with ramp Uhaul,truck-ramp
paper airplane from office paper,paper-plane
fork and knife on plate,plate-utensils
repair kit box,toolbox
food icon for a nut or allergy tracker,peanut
hearty stew with vegetables and dumplings,bowl-hot
portable toilet service truck,toilet-portable
turtle shell dome shaped pattern,turtle
felien safety symbol in pet care app,shield-cat
van public transit route,van-shuttle
Wheel the luggage to the room,dolly
smkoe detector mounted on ceiling,sensor
Set up a darkroom at home,film-canister
French bread with dinner tonight,baguette
Buy the new album on CD,compact-disc
auto body repair shop for EVs,car-bolt
cheeseburger with melted cheddar on top,burger-cheese
sol,sun-cloud
Holiday toast with champagne,champagne-glasses
Pack a flashlight for the camping trip,flashlight
cool water shower on hot day,shower
Aim for an eagle,golf-club
map pni dropped,map-pin
hazmat suit with full-face respirator,mask-ventilator
cargo on truck ramp,truck-ramp
curreny wallet pay,wallet
save every cent,cent-sign
soap lather on hands,hands-bubbles
reply comment in the thread,comment
Day planner update,calendar
chatbot robot face icon for AI features,robot
suction robot vacuum power,vacuum-robot
research for the project,book-sparkles
keep your hands clean,hands-bubbles
Artisan swiss wedge for the cheese board,cheese-swiss
seating icon for a ticketing or booking app,seat
under a dollar item,cent-sign
laces knotted at the top of the shoe,shoe
blnak card for the game,cards-blank
goods ramp access for storage facility,ramp-loading
fix the loose board,hammer
Transport boxes with the flatbed trolley,cart-flatbed
gums bleeding sign of gingivitis,teeth
Show salary in Indonesian rupiah,rupiah-sign
shippng flatbbed trolley,cart-flatbed
slither,snake
ev charger installed in the garage,car-bolt
campper trailer hitched to SUV,rv
wireless signal at close range,nfc
temerature rising fast,heat
Check the holiday wishlist,hand-heart
karaoke microphone for singing,microphone
car charger,charging-station
covid-19 virus spread pandemic,virus
instrument played in the band,drum
BBQ grilled meat on the bone,meat
DNA sequencing result in a genomics app,dna
pickleball paddle short handle wide face,racquet
Replace broken Christmas lights,lights-holiday
urban forestry programme for the downtown area,tree-city
fresh carrot with green leafy tops,carrot
filled location drop showing the current place,location-dot
hospital on the city map pin,hospital
lava flow from a Hawaiian shield volcano,volcano
soft quilted toilet paper brand,toilet-paper
Set the fork on the left side of the plate,fork
white-handled scissors for cutting,scissors
put balloons up for the event,balloons
litecoin price tracker,litecoin-sign
Feel relief after finishing the task,face-exhaling
zap,bolt-lightning
Use lavash for a wrap,flatbread
airport terminal for boarding,plane
floral summer dress for warm days,dress
penalty,goal-net
open the jar,jar
upolad a phot to the proifle,image
hourglass counting down,hourglass
snowman with a carrot nose and coal buttons,snowman
grilled chesee on sourduogh,cheese
padlock securing the gate,lock
person in motion walking forward,person-walking
black hockey puck on white ice,hockey-puck
Cook chicken on the grill,grill
toilet,toilet-paper
dead animal skull bleached by sun,skull-cow
check wheelchair accessible entrances at the venue,wheelchair
western film hero with a shiny star badge,badge-sheriff
settigns menu with tools icon in app,screwdriver-wrench
kitcen stove,oven
pizza slice with pepperoni and cheese,pizza
couch delivered and assembled today,couch
Check the magnetic north,compass
check the gbp rate,sterling-sign
pavement markings and lane dividers,road
browser,table-columns
currency field for won,won-sign
build a sandcastle at the beach,bucket
childhood snack food memories at the cinema,popcorn
overhad light in the room,light-ceiling
chrstmas stocking gift,stocking
follow the litecoin chart,litecoin-sign
adjsut the sttings,gear
cook the pork belly,bacon
Salsa and chips before the meal,burrito
cornoavirus virus covid,virus
pole,flag
utility pole near the school zone,utility-pole
muslim,book-quran
Calle pest contorl,ant
casserole,pan-food
Sort paper and cardboard for recycling,bin-recycle
notify,flag
Imitate a cow moo,cow
grup the elements,frame
turn on bluetooth for the speaker,bluetooth
minute,clock
Increase the image size,expand
church bell with a clapper inside the dome,bell
sewing thread on a wooden reel,reel
Buy a MacBook Pro,laptop
water bottle in the side mesh pocket of a backpack,backpack
ring it up at the register,cash-register
couple,people
ball sport icon for an outdoor activity tracker,volleyball
interior designer choosing paint swatches,swatchbook
inventory loaded onto warehouse ramp,ramp-loading
Casear salad with croutons and parmesan,salad
Let the dough rise overnight,croissant
Grab breakfast on the way to work,cup-togo
decorative rug in entry hallway,rug
jeweled crown on museum display,crown
protection,hockey-mask
join a badminton session this week,badminton
celebration event party horn blown,party-horn
wearable device icon in a health or fitness app,watch
Buy propane for the grill,grill
insect with colorful patterned wings,butterfly
patient information screen,hospital-user
axe used to cut branches,axe
Set up the checkers board,game-board
padlock clicked open icon,unlock
Sign up for the gym,dumbbell
Birde watching with binoculres,binoculars
Storage cabinet for the office supplies,cabinet-filing
Braille signage for the building,braille
Ophiuchus,snake
floor lamp with an adjustable arm,lamp
cornet similar to a trumpet but shorter,trumpet
glazed donut with colorful rainbow sprinkles,donut
Ring the bell at the front desk,bell-ring
beach volleyball game on the sand,volleyball
single cent value,cent-sign
storm umbrella blown inside out in the wind,umbrella
figure skating,ice-skate
recycled eco-friendly toilet paper,toilet-paper
Make smash burgers on the grill,grill
Add cream cheese to the shopping list,bagel
landspout,tornado
disk utility for the hard drive,hard-drive
cluster of cherry tomatoes on the vine,tomato
agenda pinned to board thumbtack,thumbtack
little buzzing instrument,kazoo
meter box cover opened for inspection,meter
gas protection full-face mask,mask-ventilator
reading glasses versus sunglasses,sunglasses
Buy a rustic loaf at the market,bread-loaf
shio on the open sea,ship
earbud,headphones
police user icon for a first responder app,user-police
Review the film footage,film
Play the radio in the morning,boombox
Play with the rubber duck in the bath,duck
breakfast,egg-fried
take the train to skip the morning traffic jam,train
paper scroll unrolled to reveal message,scroll
watermark applied to prevent unauthorized use,copyright
black sheep among white flock,sheep
secruity open lock,lock-open
TP-ing house halloween night,toilet-paper
Watch TV on the couch,couch
repair tools set,screwdriver-wrench
art app toolbar with pen and brush,pen-paintbrush
Shuffle the deck before the game,cards-blank
car insurence check,car
hot water tank warranty expires soon,tank-water
haul tailer cargo,trailer
attract metal objects with magnet,magnet
swimwear bra top for beachwear,bra
Unclog the sink drain,faucet
bar magnet showing field lines around it,magnet
healthy gut microbiome symbol,stomach
forecast partly cloudy weather,sun-cloud
sheep in pen at agricultural fair,sheep
peach emoji for messaging and social apps,peach
Lbel the strage boxes,box
sticks leaning against the bench,hockey-sticks
teddy bear,teddy-bear
home ofice setup new chiar needed,chair-office
open padlock not locked,lock-open
Garage workshop,garage
price on check for service,money-check
manual transmision shifted into second gear,transmission
belly,stomach
play button centered on video thumbnail,play
discount coupon clipped from a newspaper,ticket
the mushrooms at the market looked amazing,mushroom
single map marker for a saved nearby place,location-dot
waste bin,bin
radio waves broadcast pattern,tower-broadcast
pert chartt for planning,diagram-project
flu shto administered at the clinic,syringe
Check vital signs at the clinic,heart-pulse
User walkthrough at the board,chalkboard-user
venue seat map icon for an event app,seat
exchange rate from USD to INR,rupee-sign
trsah delete icon,trash
pirate booty treasure chest gold,treasure-chest
check total at restaurant table,receipt
Grill burgers for the cookout,grill
Bird watching with binoculars,binoculars
panes,table-columns
cell signal waves,tower-cell
biologist studying cell samples under a microscope,dna
Record the lecture for review later,camera
tool kit box,toolbox
moon phase icon for a weather or astronomy app,moon
imagination,thought-bubble
ice hockey game with stick and puck,hockey-stick
glitter,sparkles
smokign cigarette in a no smoking zone,smoking
Great idea!,lightbulb
map street view panorama,street-view
market,store
travel the globe icon,globe
toilet flush handle push,toilet
minimize all windows on the desktop,window
contmeplate in silence,person-meditating
cloud weather forecast icon,cloud
write notes by hand with a pencil,pencil
Mute the microphone,headset
arrow notched on the bowstring,bow-arrow
Add storage to the database server,database
save all attachments from share,share-all
inspection equipment for quality control,magnifying-glass
farming,sheep
carry the briefcase to work,briefcase
smartwatch setup for the new phone,watch-smart
automatic magic wand generate,wand-magic
children's chewable tablets,tablets
header row style for the project tracker,table-rows
write,keyboard
dramatic sunset clouds lit up,sunset
classical trumpet solo in a concert hall,trumpet
wedge,cheese
keep herbs in a glass jar,jar
paintbrush and pencil icon side by side,paintbrush-pencil
strawberry emoji icon for a food journal,strawberry
roasting broccoli with olive oil and garlic,broccoli
update the gant chart with dealdines,chart-gantt
shep shearing with electric clippers,sheep
friends helping load the moving truck at ten,truck-moving
scootre parked on the sidewalk,scooter
restart,power-off
scaarf for a cold winter day,scarf
wheelchair cushion replacement due soon,wheelchair
badge of authority pinned on a cowboy sheriff,badge-sheriff
select the checkbox,hand-pointer
olympics,curling-stone
Turn up the volume on the stereo,dial
translate language on the globe,globe
ship anchor holding the vessel steady,anchor
Visit a website,globe-pointer
Placeholder card for the project,cards-blank
mobile payment QR code at checkout,qrcode
soothe the crying baby,baby
Deep fry potatoes for fries,french-fries
freeze first column in spreadsheet,table-columns
counting,abacus
USB flash drive plugged into laptop,usb-drive
concert poster with music note,music-note
daybook schedule planning,notebook
rolling a joint with rolling papers,joint
bill total in euros,euro-sign
kielbasa Polish smoked sausage sliced,sausage
energy-saving LED desk lamp for the office,lamp-desk
buy cupcake liners at the store,cupcake
chronological events timeline,timeline
run a marathon in lightweight sneakers,sneaker
African djembe drum played by hand,drum
headphone,headphones
dental X-ray teeth panoramic,x-ray
gbp exchange rate,sterling-sign
cooking knife on the cutting board,knife-kitchen
Use the microphone for the call,headset
history,timeline
click the search result,hand-pointer
vehicle moving truck large,truck-moving
music storage device before streaming,mp3-player
advent calendar with star motif,star-christmas
got the swiss with the big holes,cheese-swiss
building warehouse storage,warehouse
streaming app play button,play
sealed envelope in the slot,mailbox
chorizo sliced on charcuterie board,sausage
hospital staff badge worker,user-doctor
tropical fruit salad with citrus slices,citrus
drag and drop swap positions,swap
microscope lens focusing on sample,microscope
large foam roller for craft project,paint-roller
wheat flour next to the mixer,jar-wheat
crew neck tshirt in solid color,shirt
Burger King drive-through run,burger
theater department logo with masks,masks-theater
open the battery cover with a screwdriver,screwdriver
remove the screw from the hinge,screwdriver
Try a new coffee blend,coffee-pot
social share button with connected nodes,share-nodes
elevator for heavy equipment,elevator
blue recycling bin for paper and cardboard,recycle
wave,wave
Cursor is not responding,computer-mouse
Plan with project management software,list-check
scenic route along coastal road,road
Move the boxes,dolly
Insect bite treatment from the camping trip,bug
Delete duplicate files on the hard drive,broom-wide
muddy paw prints from raccoon,raccoon
dagger for the rogue class,dagger
toy store teddy bear display,teddy-bear
corn taco hard shell,taco
medical journal subscription for professionals,books-medical
chargign icon on devce,battery-bolt
fridge,refrigerator
Recommend a good film,film
berry,blueberries
visit the observatory to view the planets,telescope
wallet currency foreign,wallet
screwdriver,screwdriver
Buy a joystick for the PC,joystick
high voltage,bolt
scan for a wireless network,wireless
cooked,bowl-rice
travel budget in mexican pesos,peso-sign
queen,crown
tropy for first place,award
medical research library with indexed volumes,books-medical
creat a project charrt,diagram-project
key as a password symbol,key
Book a billboard spot downtown,billboard
pickup vehicle four door,truck-pickup
garbage sorted into recyclable containers,recycle
walking step counter icon,person-walking
show a progress indicator while the file syncs,loader
fluffy mammal with curly wool coat,sheep
put a bnadage on that cut now,bandage
color brush for the drawing app,brush
rss feed delivered wirelessly to the reader,wireless
capsicm from the farmers markt,pepper
helath weight monitor,weight-scale
direction,traffic-light
bandage wrapped around a sprained wrist,bandage
Buy a new carafe for the office,coffee-pot
water the tree weekly during the dry season,tree
notifcation bell icon,bell
sacred book passed down through generations,book-quran
rdaio broadcast on AM frequency,radio
clear out the clutter,broom-wide
is there butter in the fridge,butter
try a new recpie,hat-chef
round map pin,map-pin
Set the title,heading
lift heavy cargo with the forklift,forklift
airport check-in ticket counter,ticket-airline
saxophone neck strap supporting the weight,saxophone
fmarm pig oink,pig
tortoise land turtle slow,turtle
Fix the mouse not responding,computer-mouse
task progress bar,loader
measure distance with metric ruler,ruler
listening to the heart with a stethoscope,stethoscope
repair the storage drive,hard-drive
drone front-facing icon for a flight app,drone-front
play the kazoo,kazoo
lard,bacon
Clean a scratched disc,compact-disc
bright yellow oval lemon with a pointed tip,lemon
Dungeons and Dragons wand magic,wand
Calcualte the tip,abacus
drill,oil-well
Connect to the computer,keyboard
recreational vehicle parked at campsite,rv
caduceus staff with two snakes intertwined,snake
calibrate the smartwatch heart rate sensor,watch-smart
tap phone to reader for NFC payment,nfc
Chart categories using a pie diagram,chart-pie
Apple Watch app selection,watch-apple
Read a chapter before bed tonight,book-sparkles
online chess game played on the mobile app,chess
school sports field behind main building,school
folow lab safty rules,flask
pabts for a casual day,pants
listen with headphones,headphones
Stay home today,house
robber fleeing with dollar-sign sack,sack-dollar
Join an orienteering event,compass
automatic backup toggle on,toggle-on
Clean the mouse sensor,computer-mouse
person walking in park,person-walking
move the grain sack,sack
turn the clip into a gif,gif
carry a rain umbrella just in case,umbrella
mortar and pstle,mortar-pestle
pepepr chopped for stir fry,pepper
check battery status,battery-bolt
movign trailer rental,trailer
twinkle,sparkles
jean,jeans
use ai to selcet object,lasso-sparkles
chopsticks alternative utensils,utensils
Make a dessert for the party,cookie
bug spray to repel mosquitoes,mosquito
hourglass tattoo symbolizing time,hourglass
mechanic toolkit with screwdriver,screwdriver
foam soap on hands,hands-bubbles
Aquarium visit,dolphin
yoga and meditation practice,person-meditating
Civil War cannon reenactment,cannon
beef burrger grilled to perfection,burger-cheese
three curved arcs above a filled dot in the corner,rss
Chart all tasks in the Gantt view,chart-gantt
seal the jar for canning,jar
bluetooth audio in the car,bluetooth
volumne slider in audio settings,slider
frost on the ground the morning after a snowstorm,snowman
Baking bread is on the weekend list,bread-slice
pizza,pizza
Swiss vs parmesan comparison,cheese-swiss
take the elevator to the top floor,elevator
Order artisan bread online,bread-loaf
cursive handwriting in a personal letter,signature
Chart the budget split as a pie,chart-pie
paw prnt animal,paw
bright summer shorts in a tropical print,shorts
siblings sharing a room,bed-bunk
condo viewing this weekend,apartment
Build strength with resistance training,dumbbell
morning cloud with afternoon sun break,sun-cloud
Clean the camera lens before shooting,camera
king on his throne joke,toilet
make naaan for curry,flatbread
citrus zest grated over a dessert,citrus
feed the baby,baby
Buy good audio equipment,headset
moon phase tracker for astronomy,moon
gown,dress
infirmary visit for a routine checkup,stethoscope
DB backup,database
mage class wand fantasy RPG,wand-magic
tooth,teeth
pull-out sofa bed for overnight guests,couch
Embrace the nerd look,glasses
design tool with pen and ruler,pen-ruler
sew new patches on the vest,vest-patches
telephone wire utility pole,utility-pole
deadly,radiation
hot dog,sausage
Kids sleepover with bunk beds,bed-bunk
wild berries picked from the hedgerow,cherries
heading tag used for SEO in the HTML page,heading
Care for others in need,hand-heart
cold winter day perfect for building a snowman,snowman
clipboard,paste
flock of crows circling above a field,crow
dangerous levels of radiation detected,radiation
broccoli head looks like a miniature bush,broccoli
bathoom paper supply,toilet-paper
basketball court with painted three-point line,court-sport
Go to the baseball game tonight,baseball
Learn about pachyderms,elephant
digital music player for commute,mp3-player
Use lira while traveling in Turkey,lira-sign
take the hospital elevator,elevator
campfire deep in the wilderness,campfire
extended warranty seal badge,award
paper fastened with staple not paperclip,stapler
engine starts rough,engine
run the assembly line,conveyor-belt
Piggy bank time,coins
box truck,truck-moving
traffic light signal stop go,traffic-light
clasical violen concert solo,violin
saved location marker in a maps app,location-dot
wathc a flim tonight,film
bitcoin wallet,bitcoin-sign
Extra chair for the guest room,chair
Cook a pot of rice for dinner,bowl-rice
helicopter blades spinning at full speed,helicopter
toothbrsuh twice a day,toothbrush
invnetory pallet,pallet
swiss army knfe with tools,knife
tracking drugs with a medication reminder app,pills
raised hand to ask a question in class,hand
technology hardware RAM chip,memory
children's hospital in the neighborhood,hospital
Set up the development environment,database
piano keys close-up for music,piano
splitting maul axe for log splitting,axe
holiday gathering with champagne toasts,champagne-glass
prepare sandwich fillings for lunch,bread-loaf
mechanic wrench,wrench
There are ants everywhere,ant
mosque with a large doem and minarets,mosque
old westt ghost town skull symbol,skull-cow
fire heat warming the room,fire
lorry,forklift
Business address registered in the system,building
brun a cd disc,compact-disc
buy a badminton racquet,badminton
dsl internet service at home,router
lost luggage claim at airport,suitcase
Toast to the happy couple,champagne-glasses
magci wand autocomplete,wand-magic
sunglasses left on the dashboard in summer,sunglasses
Draw geometric shapes for the project,compass-drafting
save the number in your contacts,phone
pirate black flag on the ship mast,flag
spiral-bound notebook for writing notes,notebook
pin a reminder to the board,thumbtack
need butter for literally everything,butter
Install shelving in the garage,garage
shard ride with coworkers,carpool
Configure keyboard shortcuts in settings,command
Spooky boks for Halwoeen,book-sparkles
Sketch it out,compass-drafting
ornate masquerade mask for the ball,mask
flame,fire
festive wreath with ribbon bow,wreath
Buy potatoes at the store,french-fries
flag as a symbol for the country,flag
walkie-talkie communication device,walkie-talkie
sweat droplet on the forehead,droplet
white speech bubble on a green background,message
chicken soup remedy for a winter cold,bowl-hot
tummy grumbling sound before lunch,stomach
Map the project,diagram-project
hue selection swatchbook,swatchbook
find my place,location-crosshairs
Clean the brick chimney,chimney
open the hood and inspect the engine,engine
unlock with open padlock,lock-open
grind fresh spices for flavor,mortar-pestle
open the technician tools,screwdriver-wrench
tsunami alert shown with a massive wave symbol,wave
Repair the tower PC,computer
smart lamp changes color with an app,lamp
communications,satellite-dish
anchor as a nautical tool,anchor
dolly,dolly
colorful gem in the display case,gem
coupon savings on grocery bill,money-bill
public restroom paper supply,toilet-paper
language,globe
ripe green or yellow pear on a table,pear
built-in earphone for hands-free calls,phone
Fxi the bug,ant
modem router combo from the ISP,router
papr plane send,paper-plane
jion soccer leauge,futbol
