text,label
Use sharp equipment,knife
infinity symbol used in a brand logo,infinity
medicne tablets pills,tablets
stringed instrument with doubled strings,mandolin
add color with paintbrush,paintbrush
assigned theater seat in row G,seat
Create a loop in the automation,command
the user list is getting really long,users
hair icon for a barber shop menu,mustache
tiny seedlign with two leaves,seedling
drop a pin,map-pin
remove trash can permanently,trash-can
tool inside toolbox wrench,toolbox
Egg for breakfast,egg
zzz,snooze
pencil and brush for design work,pen-paintbrush
account balance in pounds,sterling-sign
put the bottles in the recycle bin,bin
walk in the park,bench-tree
semiconductor,microchip
Unpack the boxes room by room,box-open
full sound from a floor-standing speaker,speaker
Call a plumber for the faucet,faucet
volcanic mountain visible from the coast,volcano
stargazing at night with a backyard telescope,telescope
quarry worker with heavy pickaxe,pickaxe
holiday decoration sleigh centerpiece,sleigh
Baby starting to crawl this week,ant
pushpin colorful office,thumbtack
schedule a property inspection visit,binoculars
padlock shackle open position,unlock
check the krw rate,won-sign
ear lobe with earring,ear
sports icon for a pickleball club or court booking app,pickleball
maize based taco shell,taco
forklift driving up loading dock ramp,ramp-loading
time travel in TARDIS,police-box
electric scooter parked on the sidewalk,scooter
Hit snooze one more time,alarm-clock
Dress in western wear for the event,horse-saddle
electron microscope image of material,microscope
supermarket shelf stocked with products,shelves
feather,shuttlecock
Scholar database literature review,brain-circuit
shiny apple sitting on a wooden desk,apple-whole
audio app icon for a podcast aggregator,podcast
go,traffic-light
unmanned,drone
Buy hockey equipment,hockey-puck
spy satellite with cameras pointing to surface,satellite
people with disabilities group,wheelchair
DNA icon for a health and genomics platform,dna
popsicle meltign in summer heat,popsicle
Anual physcel exam reminer,briefcase-medical
We need to unpack all these boxes,box-open
translate,language
sterring wheel car,steering-wheel
Gouda or swiss for the burger,cheese-swiss
stencil graffiti tag with spray can,spray-can
Event added to the shared team calendar,calendar
voucher code entered at checkout,ticket
clik glasses at the celebartion,champagne-glasses
unmanned aircraft controlled from the ground,drone-front
autocomplete,wand-magic
tool set in toolbox,toolbox
pack a pair of shorts for the beach vacation,shorts
slide deck displayed through office projector,projector
Take the kids to the park,bench-tree
stuffed mushrooms for the appetizer platter,mushroom
secert key revealed,key
first aid,kit-medical
water glass refilled by the server,glass
delivery courier on an electric scooter,scooter
flathead screwdriver for small screws,screwdriver
hold the gift box from both sides,hands-holding
computer virus malware infection,virus
City building permit application,building
accessibility for blind users,braille
New office building construction update,buildings
Safari time!,elephant
Caravan storage after the season,caravan
Book a hotel for the trip,hotel
cartoon sheep counting for sleep app,sheep
dining room cutlery place,utensils
team members together,people
stamp pad and rubber block,stamp
brand name filed for legal protection,copyright
hand in hand walking,people
organ diagram showing the stomach,stomach
rewind scrubber,scrubber
show people holding hands for the social screen,people
aerial tramway,cable-car
orange root vegetable growing in garden soil,carrot
patient on stretcher moved,stretcher
Find a 35mm film strip,film
plumbing,toilet
managed switch in a small office network,router
vehicle key stored on a hook in the hallway,car-key
tabletop,game-board
backpack filled with textbooks,backpack
glowing snowman ornament on a snowy lawn,snowman
edit text with a pen stroke,pen
Transportation budget review for the team,bus
overhead projector casting slides on screen,projector
add an award symbol to the leaderboard feature,trophy
conference room ceiling-mounted projector,projector
should get the wheelchair serviced soon,wheelchair
toggle button in on state,toggle-on
pumpkin with a thick brown curved stem on top,pumpkin
dagger icon for the inventory,dagger
water tank outdoor barrel,tank-water
fry an egg for brekfast,egg-fried
seal the envelope with tape,tape
page,file
caarrot soup for winter,carrot
holiday cookie box,gingerbread-man
AI is changing everything so fast,brain-circuit
speech-to-text microphone button,microphone
frankfurt sausage boiled in water,sausage
Home office setup — new chair needed,chair-office
Delet old fils from the computr,broom-wide
the garden cucumbers are finally ready,cucumber
home gym with kettlebells and dumbbells,kettlebell
organize the storage unit,container-storage
tighten the screw,screwdriver
prepare a quick breakfast,bagel
event staff walkie-talkie comms,walkie-talkie
sun sinking below horizon orange sky,sunset
handwasihng at sink with soap,sink
gold cup trophy first place,trophy
Grab a sourdogh loaf,baguette
sewre acces hatch,manhole
buy euros before the trip,euro-sign
employee record with contact details,user
breath held during a meditation exercise,lungs
nearby point of interest dot,location-dot
pet hair robot vacuum filter,vacuum-robot
in the mood for a big juicy burger,burger
stikcy tape office,tape
straship enterprise,starship
get some sleep tonight,bed-bunk
portable toolbox for home repair,toolbox
trademark protects the brand identity,trademark
paste the phone number into the form,paste
mini fridge in a dorm room or office,refrigerator
displayy resoluton set to 4K,display
rippling water surface in a calm pool,water
Play a tabletop RPG as a knight,helmet-battle
localize device position on map,location-dot
tool belt with a hatchet,axe
communiction satellite relay in orbit,satellite
Time to schedule a checkup,briefcase-medical
pay the bil,dollar-sign
Got to deal with the ant problem,ant
daylight hours increasing sunrise,sunrise
find a feather on the trail,bird
bird turkey roast whole,turkey
negociate a sallary,dollar-sign
use the changing room at the store,booth-curtain
bin lid blown off in the storm,bin
headphones hung on the monitor stand,headphones
web syndication icon for a content management platform,rss
sticky rice for sushi,sushi
clinic user record,hospital-user
Label and organize storage boxes,box
money for shopping and bills,money-bill
developer tools panel with screwdriver and wrench,screwdriver-wrench
Softball tournament registration deadline,baseball
button mushroom in a grocery shopping list,mushroom
respond to customer inquiry,reply
company headquarters visit,building
mini desktop trash can decoration,trash-can
recrod player vintage,turntable
mirror the screen to the projector,display
select,lasso-sparkles
roll coins for the bank,coins
bobbin reel for sewing machine lower thread,reel
word of god preached every Sunday morning,book-bible
target center point for dual reflection,reflect-both
Clean it up,eraser
zodiac,bow-arrow
celbeation horn,party-horn
genetic testing for cancer risk,dna
work on productin line,industry
colur coded pie caht for the sildes,chart-pie
hiking trail winding up the mountain,mountain
robotc vacuum floor,vacuum-robot
tarin track rails,train-track
wrapped,gift
Annual strategy planning retreat booked,bullseye
review the scheduel,clipboard-list
rinse all plastics before the bin,bin-bottles
spiral staircase winding upward,stairs
opne new browsr window,window
plucked strings instrument,mandolin
Lock the door before leaving,door-closed
print button in a web browser or PDF viewer,print
nhol player stick,hockey-stick
electrc plug,plug
snoaman with a carrot nose,snowman
Helium tank rental for the party,balloons
Watch elephants at the zoo,elephant
vampire bat trivia,bat
Time for bath time with the kids,bath
morning alarm going off again,snooze
robot vacuum app control phone,vacuum-robot
Type faster,keyboard
earbud headphone for music,headphones
helicopter flight over the city,helicopter
brass instrument gleaming under stage lights,saxophone
classic pigskin tossed across the yard,football
solar energy reduced by clouds,sun-cloud
hospital bed with raised safety rails,bed
magnifying glass tilted left,magnifying-glass
blackboard,chalkboard
board game puzzle challenge,puzzle
breakfast taco egg bacon cheese,taco
map address lookup tool,map
missing piece of the jigsaw puzzle,puzzle
strength,kettlebell
graphic design tool spray can,spray-can
maximize icon in window title bar,maximize
Make a food dish with eggs,egg
Build a fantasy character,helmet-battle
color,droplet
Game on!,gamepad
camara settings for low light,camera
amusement park,ferris-wheel
portable restroom by the entrance,toilet-portable
Storm warning this evening,bolt
hockye puck on the ice,hockey-puck
Avoid gambling problems,dice
two hands under the package,hands-holding
Mark the position on the map,crosshairs
manage app preferences,gear
documet scanning app on smartphone,scanner-image
pils taken twice a day,pills
lip sync performance on the stage,lips
add a grain bowl to the nutrition feature,plate-wheat
self-storage warehouse units small,warehouse
system settings,gear
shower cabin with glass door,shower
tomato,pizza
traditional Spanish paella dish,pan-food
Attract,magnet
restaurant utensils table set,utensils
rock and roll,guitar-electric
multi-use tool kit,wrench
violin solo played by a concert master,violin
public transportation going electric,car-bolt
halloween bat decorations,bat
scale up a thumbnail to full view,maximize
Order a dozen bagels,bagel
forest,tree
gold star-shaped sheriff badge pinned to a vest,badge-sheriff
Vehicle registration renewal,car
car offroad tire muddy terrain,tire-rugged
Use lasso tool to trace the outline,lasso-sparkles
IT infrastructure icon for a network management app,router
caliente,fire
coment on the post,comment
remove users,users
loding spinner,loader
assigned movie seat number on a ticket,seat
bra size guide in an apparel shopping app,bra
wireless display sharing icon in settings,screencast
bakcup the databse,database
influenza flu virus,virus
garbge can outdoor,trash-can
Swiss souvenir priced in CHF,chf-sign
crush plastic bottles before recycling,bin-bottles
books filled with knowledge,books
go online plug in device,plug
pharmacy dispensing tablets into bottle,tablets
price shown in Indonesian rupiah,rupiah-sign
fire axe mounted on an emergency wall bracket,axe
volleyball,volleyball
telemedicine doctor profile virtual,user-doctor
laso sparkles editting,lasso-sparkles
popsicle,popsicle
disk full on the workstation,hard-drive
sunset notification end of day reminder,sunset
final destination pin dropped,location-dot
Dutch airport gift shop stroopwafel,stroopwafel
deli counter sandwich with turkey and swiss,sandwich
grim reaper holding sickle scythe,sickle
skip the line at checkout,bag-shopping
travel guitar for the musician on the road,guitar
warning sign for ionizing radiation in a lab,radiation
horseshoe magnet in science class,magnet
prize,trophy
stair count for fitness tracker steps,stairs
park and tree icon for a smart-city dashboard,tree-city
cotton underwear boxer shorts,shorts
assorted berries in a summer dessert,cherries
satellite dish hardware installation,satellite-dish
digitize old photos with scanner,scanner-image
Buy a BPA-free water container,jug-bottle
traditional pot cooking stew,pan-food
Plantt a tree in the yadr,bench-tree
closed door policy during the meeting,door-closed
map screen in navigation app,map-location
fix broken device with combined tools,screwdriver-wrench
Use H1 for the main title,heading
cheatsheet,clipboard-list
hospital icon for a healthcare app,stethoscope
tap snooze buton to delay alarm,snooze
vintage,film-canister
ergonomic backpack with adjustable padded straps,backpack
Pick crab claws for dinner,crab
bible vrese displayed every morning,book-bible
Kitten adoption at the shelter,cat
Unload the delivery truck,dolly
circle dot on media timeline scrubber,scrubber
Play a tabletop game,game-board
copay and paste,paste
medieval sickle used for cutting crops,sickle
Cat flea treatment due,cat
apple emoji for healthy snack reminders,apple-whole
play chekers with frined,game-board
convection oven circulates hot air,oven
store extra inventory in the container,container-storage
gift given to a close friend,gift
Clean the fireplace ash,chimney
language selector with a globe icon,globe
pin the meeting point,map-pin
clibrate the displaay color,display
check cashing at the bank teller,money-check
bluetooth keeps disconnecting,bluetooth
diet progress weight tracker,weight-scale
maize,taco
Pick up grocries,bag-shopping
repair the engine,engine
trunk,elephant
proceed to checkout,bags-shopping
bristles,brush
cargo truck ramp unload,truck-ramp
tournament chess player ranking list,chess
stem attached to a pair of cherries,cherries
repair shop sign with crossed tools,screwdriver-wrench
garden watering setup,hose-reel
check wireless signal bars,wireless
skillet with breakfast food,pan-frying
bite,mosquito
prompt,terminal
hockey equipment bag with sticks,hockey-sticks
wheta bowl,plate-wheat
dungaree,jeans
dog vaccination reminder with shield icon,shield-dog
vegan and eco-friendly seedling symbol,seedling
srot the bottels into the bin,bin
new message alert with unread count badge,message
Fax the form,fax
burger and fries kind of day,burger
package tape for shipping box,tape
microchip soldering for the electronics class,microchip
Bake a batch of baked goods,cookie
baseball practice,baseball
gender-neutral person icon for an inclusive platform,user
stovetop and oven combo unit,oven
scan wireless networks,wireless
weather satellite image of hurricane,satellite
Santa Claus riding sleigh with gifts,sleigh
money wallet zip around,wallet
eeg frying,pan-frying
dollar sign on a bulging money bag,sack-dollar
enlarge text on screen,magnifying-glass
on-off toggle slider button,slider
pair of cherreis on a green stem,cherries
Add a reminder for the dentist,alarm-clock
Check the weather for lightning,bolt
melt,cheese-swiss
sharp blade of a medieval sword,sword
rip the cds to digitla,compact-disc
postcard,mailbox
vinyl record turntable sound,turntable
mexican,burrito
copyright law protecting creative works,trademark
Soup can for a quick lunch,can-food
loose underwear shorts in a cotton blend,shorts
outdoor public trash can park,trash-can
spreadsheet,table-rows
mobile slot machine game app,slot-machine
fresh pastries at the corner bakery,bread-loaf
manual pallet jack lifting pallet,pallet
baby,baby
fitness wristwatch sport,watch-fitness
leather bifold wallet with cards,wallet
creative tools icon for design apps,paintbrush-pencil
telephone,phone
cell tower antenna structure,tower-cell
Seat adjustment for the work desk,chair-office
Prepare the image for the blog,crop
pickup truck towing boat trailer,truck-pickup
pills and capsules in the bottle,capsule
View the presentation in fullscreen,expand
retrofit ceiling sprinklers in older buildings,sprinkler-ceiling
Storage unit access to unpack items,box-open
Apply to graduate school,diploma
musical melody in a song,music-note
need to find a wheelchair accessible restaurant,wheelchair
custom logo stamp for branding,stamp
Enjoy the day despite the clouds,clouds-sun
healthy tehth and gums icon,teeth
fork silver dining,utensils
cupcakes are way easier than a full cake,cupcake
items moving on the belt,conveyor-belt
Check the golf course weather,golf-club
grab the wrench from the toolbox,wrench
roshambo game hand gesture,hand
stairs exercise routine in the morning,stairs
Oncoming vehicles on the shared route,carpool
memory chip on circuit board,memory
glass of water placed beside the plate,glass
recreational sport icon for a wellness tracker,pickleball
dice,dice
replace the old wooden pole with a new one,utility-pole
thumbtack marker on board,thumbtack
meeting place pinned,map-pin
elf ornament that moves to a new spot each night,ornament
open the archive box,box-open
pie cahrt for the qarterly reprot,chart-pie
stroopwafel dessert coffee pairing,stroopwafel
snoman standing in the yard,snowman
username user large display,user-large
show a spinner while content is fetching,spinner
septic tank underground water,tank-water
staplre for papers,stapler
list of hospitals,hospitals
brush to modify the color layer,brush
dinghy,sailboat
sipder hanging from a web,spider
Clear out the storage area,broom-wide
food plated as a colourful salad,salad
party favor noise maker for kids,party-horn
reindeer,deer
hide item trash archive,trash
luanr calendar for moon phases,moon
natural gas and oil well,oil-well
adjusting the chair height all day,chair-office
radar dish scanning for aircraft,satellite-dish
mailbox at the end of driveway,mailbox
Transport goods from the warehouse,industry
Download the album for offline listening,cloud-music
address,microphone
Build a sandcastle at the beach,bucket
map coordinate targeting marker,location-crosshairs
wine tasting event,wine-glass
Monitor the progress bar,list-check
tire change auto service,tire
resort,hotel
CC button in video player controls,subtitles
exchange axis to mirror layout,reflect-both
dairy,butter
technical books for API documentation,books
safety symbol for cat vaccination,shield-cat
sweeping wind lines curving across the screen,wind
mexcian food tonight for sure,burrito
puree,blender
Use shortcuts to save time at work,command
Carnitas burrito from the food truck,burrito
unlocked account on the dashboard,lock-open
Zoom in,expand
repair equipment including screwdriver,screwdriver
moon,moon
identification by fingerprint,fingerprint
show an axe icon for the woodcutting ability,axe
show scissors for the clip action button,scissors
sweep the wide area,broom-wide
zap,bolt
fish-oil omega-3 capsule,capsule
driving through blowing snow on highway,snow-blowing
pinball gme,pinball
ksis lips symbol,lips
mirror,airplay
We won!,flag-checkered
wheelchair ramp installation next week,wheelchair
Guitar practice!,guitar-electric
use the wahing machine,dryer
inverse transform on both dimensions,reflect-both
Don't be late!,clock
envelope delivered to mailbox,mailbox
halloween toilet paper prank trees,toilet-paper
Score an eagle on hole 5,golf-club
messge from a friend,message
Set up the design canvas,frame
progress spinner while task runs,spinner
tranportation taxi ride,taxi
dollar sack representing investment returns,sack-dollar
Learning facilitated by the teacher at the board,chalkboard-user
Homemade beerd for dinner,bread-loaf
The rice cooker is my best friend,bowl-rice
large vehicle with beds and kitchen inside,rv
smartwatch display current time,watch-smart
category,table-columns
Plot the route on a chart,compass-drafting
jar of pickle on the shelf,cucumber
Dyson vacuum cleaner powerful,vacuum
Point the cursor at the goal marker,bullseye-pointer
Vampir bat costume,bat
hold the bag for me,hand-holding
blizzard,snow-blowing
orange basketball with black curved seam lines,basketball
ergonomic steering wheel grip,steering-wheel
hass,avocado
yolk,egg-fried
compare sterling against the euro,sterling-sign
Duplicate the file before editing,copy
nailed it — right on target,bullseye
drema bubble floating,thought-bubble
repair the cracked step on the front porch,stairs
soak in the tub,bath
Nothing sounds more like Christmas than bells,bells
tuning into an fm station on the stereo,radio
interconnected alarm sensor network in building,sensor
Cashier busy at the counter,cash-register
road map of a city,map
suhsi nigiri salmon,sushi
Electric fence warning,bolt
sprinkler head with glass bulb fuse,sprinkler-ceiling
Morning walk,dog-leashed
savigns piggy bank,piggy-bank
Put plastic bottles in the bin,bin-bottles
Clean the garage,garage
robot cleaning vacuum autonomous,vacuum-robot
spread avocado on toast for a healthy breakfast,avocado
destiantion map,map
Nothing like old school boombox vibes,boombox
sick patient resting in a medical bed,bed
toilet paper essential supply,toilet-paper
violin,violin
pharmcy symbol,mortar-pestle
car needs a wash badly,car
set up the dekstop,computer
show saved addresses on the map,map-location
localize nearby places on map,map-location
id,fingerprint
Clen the drivwey with a wide broom,broom-wide
current location crosshair marker,location-crosshairs
bone,meat
wand sparkles creative tool,wand-magic
street taco with cilantro and onion,taco
weather icon representing wind or breezy conditions,wind
Set the coffee maker timer for morning,coffee-pot
deaf awareness month symbol,hands
steak with bone for dinner,meat
evolution from single cell to complex life,dna
scripture reading marked with a ribbon bookmark,book-bible
shoorts for a summer day,shorts
knife skills class at the culinary school,knife
billfod slim wallet,wallet
shiping the container,container-storage
hikign person trail,person-hiking
cozy seating for two people at home,loveseat
gift,stocking
Monitor the manufacturing line,industry
grab the hammer from the bench,hammer
small hatchet for the hiking pack,axe
electronic device sleep or power-off button,power-off
cookie person with icing,gingerbread-man
press the button on screen,hand-pointer
Add to favorites,album
car service airport pickup,taxi
green corridor connecting city parks with trees,tree-city
living room two-seat couch icon,loveseat
speech bubble with three dots indicating typing,message
hospital teddy bear donation charity,teddy-bear
ches tournament on satruday,chess-board
steaming bowl of hot soup with vapor rising,bowl-hot
feline safety symbol in pet care app,shield-cat
turn up the volume during a workout playlist,volume
move the bag to the car,hand-holding
Save energy with LED bulbs,lightbulb
copyright notice printed at the bottom of the page,copyright
glacier slowly moving down the valley,mountain
modify settings using vertical sliders,sliders
manhoel cover on wet roard,manhole
Erase notes from the chalkboard,eraser
motorcycle helmet and riding gear,motorcycle
infinite loop symbol in software design,infinity
pet bunny in a hutch,rabbit
mountain sunset alpenglow effect,sunset
see wild animlas in the forest,deer
prepaid SIM card from convenience store,sim-card
finisher medal with running shirt at race,shirt-running
cherry blossoms falling like pink snow,cherries
Buy fresh seafood,crab
intelligent reasoning brain,brain
buzzing kazoo,kazoo
Print on paper,copy
mechanic usign screwdriver on car,screwdriver
warehouse dock ramp for deliveries,ramp-loading
the cupcakes turned out great last time,cupcake
mix,mortar-pestle
pop into the store on the way back,bags-shopping
cob,corn
railway,train-subway
monitor ltc market,litecoin-sign
mobile,mobile
pharmacy logo mortar and pestle symbol,mortar-pestle
automotive service wrench,wrench
wilderness,campfire
tablet device on desk,tablet
lab microscope for specimen,microscope
reading pedestal with built-in light,pedestal
bakng in oven,oven
turtle slow pace racing hare,turtle
standing figure used as a person icon,person
Slice and dice,knife
Order falafel from the restaurant,falafel
use a compas to navigate,compass
receipt as legal evidence of transaction,receipt
achivment award,award
moor the baot with anchor,anchor
buggy,baby-carriage
pedestrian walk don't walk signal,traffic-light
premium tier shown with gold money bag,sack-dollar
flame,campfire
crossed hockey sticks patch,hockey-sticks
car transport trailer multiple vehicles,trailer
world map wallpaper with countries,map
puzzle piece fitting into slot,puzzle
sauna het session,heat
online store website product listing,store
addon installed in the application,puzzle
trombnoe playing a low note,trombone
red pin marker for one selected destination,map-pin
walker with hand brakes,walker
Reminder before the flight,alarm-clock
Fluff the sofa cushions,couch
New knife set,knife
summer shorts on a beach day,shorts
magnifying view for accessibility,magnifying-glass
position,crosshairs
marine,dolphin
Plan activities for the day,cloud-sun
severe weather alert lightning warning,bolt-lightning
teleohone poole with wires,utility-pole
Clear browser history and cache,browser
monitor the btc market,bitcoin-sign
rabbit,rabbit
Bake homemade flatbread,flatbread
protein structure determined by gene sequence,dna
butterfly wings with colorful patterns,butterfly
no smoking sign at the entrance,smoking
pickled cucumber in a mason jar,cucumber
green salad,salad
sweet frozen confection on a stick,popsicle
construction tool icon for a work or project app,shovel
sweet summer fruit on the table,peach
loading timer circular progress,timer
Calibrate the instrument dial,dial
gut health tracked in a nutrition app,stomach
saved place on map,map-location
luggage weight scale airport,weight-scale
pin this item to the board,thumbtack
globe with speech bubbles in different languages,language
desk lamp icon for a productivity app,lamp-desk
delte empty rowss,table-rows
Separate plastics from general waste,bin-bottles
pallet box scanned at the loading dock,pallet-box
secure the pistol after use,gun
Something is crawling in the kitchen,ant
Work in customer support,headset
pale white moon with craters on the surface,moon
Check which plastics can be recycled,bin-bottles
semi-truck pulling a trailer on the highway,truck
