text,label
Condominium rules and regulations review,apartment
Feel dizzy after spinning around,face-woozy
covid-19 checkup with a stethoscope,stethoscope
storage unit accessible via loading ramp,ramp-loading
natual organic soap bar with herbs,soap
set the heat temperature on the dial,heat
battle helmet dropped on the dungeon floor,helmet-battle
bisque,bowl-hot
Trim the video clip,crop
Kitten-proof the apartment before arrival,cat
chemistry experiment vial,vial
Search the directory for the address,compass
renew the moped insurance,moped
oral hygiene icon for a wellness tracker,toothbrush
salary in euros,euro-sign
tooht ache after eating sweets,tooth
Ergonomic setup review with the physiotherapist,chair-office
Visit the business downtown,building
alarm clock for 6am,alarm-clock
Open the care package,box-open
wash face with gentle soap,soap
food icon for a nutrition tracker,avocado
queued up for the cable car,cable-car
make a batch of gingerbread men,gingerbread-man
clean and oil the wheelchair wheels,wheelchair
Carpool buddy system for the daily commute,carpool
moving van ramp extended for loading furniture,ramp-loading
knowledge from multiple vials test,vials
Pet the cow at the farm,cow
drum set in the recording studio,drum
comment chat,comment
hands raised in greeting gesture,hands
Design the store signboard,billboard
Electric car charging network map,charging-station
Take photos on a disposable camera,film-canister
office chair with headrest for tall users,chair-office
smartwatch paired with phone,watch-smart
bicuspid tooth between the canines and molars,tooth
mirro image along center axes,reflect-both
report,flag
electric meter on side of house,meter
status indicator showing current temperature,thermometer
Use the torch to navigate in the dark,flashlight
green salad for healthy eating,salad
Unpack boxes in the new apartment,box-open
hearts emoji for expressing love,hearts
share,screencast
pocast about technology news,podcast
podcast host speaking into mic,microphone
weare a cloak costume,hood-cloak
wet surface warning icon on a floor,water
trumpett with a golden finish,trumpet
longhorn cow skull with curved horns,skull-cow
chat icon for a messaging app,message
magic selection tool removes the background,lasso-sparkles
orchestra pit with a row of trumpet players,trumpet
Refactor old code,code
Oscar trophy movie award,trophy
Broadway drama masks symbol,masks-theater
I need an address book icon for my contacts app,address-book
two peanuts inside a bumpy oval shell,peanut
Precise objective tracking with cursor,bullseye-pointer
thougth bubble comic,thought-bubble
ketchup,french-fries
picture postcard in mailbox,mailbox
USD dollar bag for US currency,sack-dollar
global hunger awareness icon,plate-wheat
rock and roll guitar power chord,guitar
spool,reel
dark sky at midnight with stars visible,moon
player swinging the bat at a fastball,baseball-bat
labeled point of interest on map,map-location
empty glass turned upside down on a shelf,glass
round wristwatch with an analog dial face,watch
meeting friends at the campfire,campfire
bitten choclate cookie,cookie-bite
gold,treasure-chest
yellow bell pepper chopped for a salad,pepper
RAm module upgrade,memory
sundress for a summer picnic,dress
sushi roll on wooden board with ginger,sushi-roll
speakre playing music outdoors,speaker
track packages on the conveyor,conveyor-belt
Dog food portion ready for the morning,bowl-food
Ask for directions in the city,compass
Spotted a deer,deer
walking person icon dropped on map,street-view
bowling bll rolling down the lane,bowling-ball
watch the baseball game,baseball
waving flag in the breeze,flag
alley,bowling-ball
Do breathing exercises to calm down,face-exhaling
piece,puzzle
Make stir-fry tonight,chopsticks
Change the config,gear
rubber tire durable material,tire
lipstick on the lips,lips
ear listening to the music,ear
import document image from scanner,scanner-image
medicine injected directly into the bloodstream,syringe
ewe,sheep
instal celing light fixutre,light-ceiling
transfer files wirelessly nearby,nfc
bike ride this weekend,bicycle
medical lab technician using microscope,microscope
TMNT teenage mutant ninja turtle,turtle
Whole grain bread slices,bread-slice
school building with flagpole out front,school
chimey sweep appointment,chimney
loader icon with percentage complete label,loader
colorful Buddha bowl with grains and vegetables,salad
cloudy sumemr weather,clouds-sun
Refill the water bottle,bottle-water
engine inspection before purchase,engine
Speed up workflow with shortcuts,command
handheld microphone for live performance,microphone
prok chop dinner,steak
fresh orange cross-section showing segments,citrus
ingredient icon for a recipe or cooking app,mushroom
surgeon operating room,user-doctor
Work commute to the downtown building,building
store loose change in a jar,jar
IMG format converted to JPEG,camera
gold coin reward in the game,coin
wrapped gift under the christmas tree,gift
superhero mask covering the eyes,mask
pull the car into the garage,garage
putter used on the final green,golf-club
Unpack the moving boxes,box-open
serach icon,magnifying-glass
lounge on the couch with a good book,couch
won exchange alert,won-sign
offrroad mud tire,tire-rugged
first aid bandage for minor cuts and scrapes,bandage
notify with a flag marker,flag
watre tank level check,tank-water
police icon for an emergency contact screen,user-police
pop the balloons after the party,balloons
rich hot chocolate on a cold winter night,mug
fireman axe for breaking down doors,axe
Lard substitute for the pastry dough,bacon
Move out of old apartment,apartment
artist holding palette while painting,palette
pste the text into docment,paste
slap shot sends the puck flying,hockey-puck
Cupcake tower instead of a birthday cake,cake-candles
Winter skate,ice-skate
share all button distributing content widely,share-all
woman and man holding hands emoji,people
church spire visible above the rooftops,church
fantasy world archer in enchanted forest,bow-arrow
Organize the storage room,container-storage
Strategy pointer for the presentation,bullseye-pointer
toy band with kazoos,kazoo
It's going to be cloudy today,clouds-sun
pair of trousers folded neatly in half,pants
lace up the hiking boots and go,boot
smart water bottle syncs with the health app,bottle-water
users with mobility needs,wheelchair
Buy food for the dog,dog
doobie,joint
set up the tent before it gets dark outside,tent
admin lock for restricted access,lock
group and ungroup feature in UI editor,object-group
shield protecting small pet,shield-cat
sign language interpreter hands in motion,hands
Web application performance audit,browser
dual art tool for painting and marking up,paintbrush-pencil
royal decree written on formal scroll,scroll
sample,vials
btc,bitcoin-sign
vintage hourglass as a time symbol,hourglass
swet candy treat for kids,candy
show lungs for the breathing exercise feature,lungs
medical profile for the patient,hospital-user
subsricbe to spotify,cloud-music
Practice chess openings this evening,chess-board
Tub faucet dripping — fix it,bath
christianity symbol for a faith app,book-bible
Celebrate the promotion with champagne,champagne-glasses
Anniversary gift and dinner plan tonight,cake-candles
moivng truck rental,truck-moving
shovel snow from the driveway after a blizzard,shovel
Portable Stereo,boombox
TV monitor dual display,tv
sand,hourglass
face-off at center ice tonight,hockey-puck
paperclip,stapler
sushi restaurant counter display,sushi
defualt user avatar,user-large
Track expenses and income,dollar-sign
vip,crown
tenis racket with string grid,racquet
Find a new game to try,curling-stone
fire hose by the stairwell,hose-reel
Cycle to work tomorrow,bicycle
person,user-large
tobacco and health icon in a medical reference app,smoking
chop,steak
Build a crate for shipping,container-storage
Kick the ball in practice,futbol
warehouse building large industrial,warehouse
head to the store,bags-shopping
Attach the file to the email,copy
Book lodging for the trip,hotel
locked,door-closed
cob of corn boiled and buttered,corn
Cool off in the hot weather,fan
Kitty window perch installation done,cat
Press the d-pad to navigate,gamepad
barcode scanner reading product label,qrcode
flora and fauna preservation effort,seedling
users list people,users
apps,watch-smart
holidy gift exchange,gift
cucumber and cream cheese sandwiches for tea,cucumber
zoo monkey on a rope,monkey
drivetrain diagram showing gearbox and axle,transmission
wet,water
tennis ball mark on racket strings,tennis-ball
Number practice,abacus
salad fork smaller than the dinner fork,fork
floor plan drafting pen ruler,pen-ruler
stpwatch timing a sprint race,stopwatch
decorate cookies for the holidays,gingerbread-man
pepperoni sausage sliced on pizza,sausage
classic homemade pie,pie
Buy a harness for the pet,dog-leashed
tank top,shirt-running
steak knife cutting through tenderloin,steak
company directory listing all employees,address-book
wooden pallet with a sealed cardboard box,pallet-box
the paste shortcut isn't working,paste
vertical mounted traffic signal,traffic-light
Mall shopping this afternoon,bags-shopping
sale starts today,badge-dollar
broccoli icon for a vegetable or grocery app,broccoli
lovesat couch,loveseat
mini cupcake served as a party favor,cupcake
School teacher at the classroom board,chalkboard-user
My phone is almost dead — need to charge it,battery-bolt
music player with earbuds included,mp3-player
paste the text into the document,paste
cop directing traffic at the intersection,user-police
hand raised in the classroom,hand
cookie,stroopwafel
fast,rabbit
burrito,burrito
Cardio check,heart-pulse
Replace the old network cable,ethernet
listen to music with headphones,headphones
buy a new lesah,dog-leashed
Collect a signed hockey puck,hockey-puck
staff elevator only,elevator
mailboc full of letters,mailbox
expand,expand
Order helium balloons for the event,balloons
seedling,seedling
receipt in euros,euro-sign
show an anchor for the link element,anchor
math infinity symbol in calculus,infinity
Organize a summer BBQ party,grill
Replace a broken keyboard key,keyboard
negative image created by full axis inversion,reflect-both
borwser window open,window
hardware components of satellite in space,satellite
retro arcade hall,pinball
camper van parked at a national park,van
cupcakes for the kids birthday party Saturday,cupcake
community,church
sticky note reminder memo on the desk,memo
way easier to read than a table,chart-pie
inline reply nested under original message,reply
keyboard,keyboard
raindrop falling from the sky,droplet
formula prepared and poured into the bottle,bottle-baby
show the pipe wrench for plumbing,wrench
cook a roast in oven overnight,oven
Order poutine in Canada,french-fries
wether satellite image of hurricane,satellite
Dog walk time,dog-leashed
world map showing all continents,map
map with route and destination marker,map-location
connect devices with NFC,nfc
wild primate swinging through jungle,monkey
ice hockey stick and puck,hockey-stick
add a generous schmear on top,bagel
volcanic smoke column visible for miles,volcano
moving truck rental company,truck-moving
mushrooms,mushroom
grab the magnifier for the map,binoculars
reading,glasses
Use the viewfinder to frame the shot,expand
Use the garage as a warehouse,garage
paenut in a shell,peanut
I need an umbrella icon for my weather app,umbrella
Write an SQL script to update data,database
exchange rate display from USD to RUB,ruble-sign
orange alert cone warning,traffic-cone
App glitch after the latest update,bug
carry the hamper together,hands-holding
body,eye
warming a baby bottle under warm running water,bottle-baby
sailing across the harbor on a sunny afternoon,sailboat
toggle button in off state,toggle-off
Research for the school project,book-sparkles
heat,campfire
dizzy,face-woozy
Downlod the ablum,album
deposit bitcoin to the exchange,bitcoin-sign
Storm alert for tomorrow,bolt
soy sauce dipping for nigiri,sushi
student surrounded by stacks of textbooks,books
Give me five more minutes,clock
buy cucumbers,cucumber
caldera lake inside an extinct volcano,volcano
Edit frames in the video,film
triangle pointing right to play,play
freshly squeezed citrus juice in a glass,citrus
archive files on the hard drive,hard-drive
electric car charging at the station,car-bolt
iice axe climb,pickaxe
church as a religion landmark,church
Go on a safari,elephant
hand wave greeting gesture,hand
rocket-powered space shuttle ascending,shuttle-space
blue denim jeans with a worn wash,jeans
currency app for krw,won-sign
salary wallet paycheck,wallet
reference book opened for academic research,book
Multiplication table practice,calculator
refill the baking jar,jar-wheat
porcelain,toilet
fantasy RPG loot box,treasure-chest
Swimming with fish while snorkeling,fish
Frosting colors for the cake,cake-candles
makeup brush similar to paint brush,paintbrush
unlocekd padlock,lock-open
edit artowrk with brush or pencil,paintbrush-pencil
stduents lined up at school entrance,school
Keep driving fast to make it on time,gauge
Send a facsimile of the contract,fax
Abacus alternative digital calculator,calculator
desktop computer with a large display,display
take the buggy out,baby-carriage
speech bubble popping up in a chat,message
point at the feature you want,hand-pointer
research notebook filled with clinical findings,book-medical
computer connected to TV,tv
crescent,moon
toe socks with individual compartments,socks
chop served with vegetables,steak
lock the moped before going inside,moped
vault lock combination dial,vault
club selection for the par-4 hole,golf-club
solve abs equations,value-absolute
large orange gourd on a wooden porch,pumpkin
clena the water tnk,tank-water
Book a dolphin watching tour,dolphin
play a song in a music streaming app,music
Feed the cat this evening,cat
hour,hourglass
Adjust the gears before the long ride,bicycle
mobile signal indicator in status bar,signal
Buy new Christmas lights,lights-holiday
Grad party time,diploma
skeletn screen while conent loads,loader
bill total in krw,won-sign
postbox on street corner,mailbox
handle,brush
D&D wand spell cast,wand
Inspect the mechanical parts,gear
multi-window desktop layout,window
Grab something for dinner on the way back,bag-shopping
arrows pointing in opposite direction,shuffle
garden hose mounted on the wall,hose-reel
payment at checkout,basket-shopping
empty inbox after clearing all messages,inbox
red postbox for outgoing mail,mailbox
wooden bookshelf with rows of books,shelves
compost bin for organic waste recycling,recycle
tobacco product warning label,smoking
Butter in the baking recipe,butter
siegecraft knight wearing a tower-shaped helmet,helmet-battle
silver chopsticks for a formal Japanese meal,chopsticks
the patch is coming off the vest again,vest-patches
brocoli florets with garlic,broccoli
mushrooms - dinner,mushroom
qr square matrix code pattern,qrcode
planning room dimensions with ruler,ruler
emergency weather updates on a battery powered radio,radio
flower blooming in the garden,flower
glazed donut from the bakery,donut
mindfulness meditation session at sunrise,person-meditating
charity,hand-heart
paml facing forward,hand
Write a fantasy story with a rogue,hood-cloak
medication,capsules
screen time on mobile phone,mobile
frames,film
price the item in pounds,sterling-sign
palelt box in warehoues,pallet-box
subway train metro rapid,train-subway
frozen banana blended into a smoothie,banana
cross country moving truck service,truck-moving
vehicle with living quarters for family trips,rv
crown symbol for the top-rated item,crown
lock the e-scooter at the station after your ride,scooter
adult,user
combne objects,object-group
unlock screen gesture on a mobile device,unlock
remote area cell tower expansion,tower-cell
solar holidy string lights,lights-holiday
Vehicle charging port compatibility check,charging-station
creative editing combined tools,paintbrush-pencil
Learn about frog life cycles,frog
filing,cabinet-filing
Watch deer in the forest,deer
goober,peanut
royal decre written on formal scroll,scroll
restautant check with tip line,receipt
tragedy mask with downturned mouth,masks-theater
home energy wall outlet,outlet
find the right hospital,hospitals
crow landing on a fence post at dusk,crow
resize window,window
Grocery list synced to the shopping app,cart-shopping
motor scooter,moped
call,mobile
email inbox with unread notifications,inbox
garage filled with boxes during the move,garage
Mirror iPhone screen,airplay
partnership represented by two joined hands,handshake
medicine capsule with powdered contents,capsule
hunter in the forest with a longbow,bow-arrow
tiket to the concert,ticket
open the storage container,box-open
show an unlock for the premium feature gate,unlock
Walk in the park with the baby,baby-carriage
payment in Indian rupees at checkout,rupee-sign
green apple sliced for a cheese board,apple-whole
musci played on drum,drum
carott salad recipe,carrot
woman,people
gift stuffed stocking surprise,stocking
switch turned off position,toggle-off
islam,mosque
gaming headset with surround sound,headphones
handheld vacuum car interior,vacuum
pricre range slider on shopping site,slider
Erase the meeting notes from the whiteboard,broom-wide
garbage can full of waste,trash-can
Play rock music all night,guitar-electric
boiling spuds for mashed potatoes,potato
put sugar in the jar,jar
airprot shuttle van service,van
buy a lot of things today,bags-shopping
space exploration icon in a NASA-themed app,telescope
tax invoice receipt for VAT purposes,receipt
shuffle icon with crossed arrows,shuffle
vial,flask
prescription tablets pharmacy,tablets
takeoff or landing airplane,plane
family loading up RV for summer vacation,rv
traffci light signal,traffic-light
Office supplies packed in the briefcase,briefcase
D&D loot mandolin in campaign,mandolin
develoment project setup,code
birtday cake pice for dessert,cake-slice
pay the hotel in euros,euro-sign
stairwell cleaning on the schedule,stairs
allergy warning icon in a food labeling app,peanut
insert shape button in word processor,shapes
track the pound exchange rate,sterling-sign
heading hierarchy H1 H2 H3 in the doc,heading
refrigerated shelf in grocery store,shelves
zap the bugs,bolt
knife used to cut ingredients,knife-kitchen
plastic,bottle-water
access codes on USB drive,usb-drive
ice axe for glacier climbing,pickaxe
moving truck big enough for the whole apartment,truck-moving
flour container in the cupboard,jar-wheat
New laptop!,laptop
office chair assembled from flat-pack,chair-office
root tuber harvested in autumn,potato
collapse map view to small panel,minimize
business socks worn under dress trousers,socks
syringe filled and ready for injection,syringe
grilled cheese sandwich with melted cheddar,sandwich
glass lens for zooming in,magnifying-glass
GPS dot indicating current coordinates,location-dot
deposit the paycheck at the bank,money-check
euro exchange rate,euro-sign
piggy bnak savings,piggy-bank
seasonal campfire gathering in autumn,campfire
Fede the dgo this evenng,bowl-food
lok the front dorr,door-closed
return the rental wheelchair after the trip,wheelchair
sotpwatch measuring elapsed time,stopwatch
makeover work,hammer-brush
New broom for the kitchen and hallway,broom
Transport equipment to the venue,dolly
quick NFC scan to launch app,nfc
drain the flooded basement with a pump,pump
nurse,bottle-baby
pack the work bag,briefcase
cupcake ingredients from the grocery store,cupcake
tap to open details,hand-pointer
paper memo printed and posted on the board,memo
Check out that condo downtown,apartment
kicked football sailing between the goalposts,football
car parked safely in the garage overnight,garage
Ship's cannon on the pirate display,cannon
instlal a new ceeling light,light-ceiling
row grouping for the budget template,table-rows
portable toolbox,toolbox
legal document scanned for digital signature,scanner-image
purchase history transaction,store
Watch a cooking show for inspiration,hat-chef
Complete the settings checklist,list-check
shiny dime worth ten cents,coin
outdoor event icon with protection from the weather,umbrella
scooter hire app showing available nearby,scooter
rolled-up area rug for moving or storage,rug
Explor machin lerning concpts,brain-circuit
Pick up the kids from school by car,car
alert from smoke sensor activated,sensor
communication,webhook
Make a corn dog batter,hotdog
recycling bin next to trash can,trash-can
orchestral instrument icon for a classical music app,trombone
penalti kick in footbal,futbol
route map,map
video file format MP4,video
wedding dress with a long train,dress
Update the work schedule,clipboard-list
trophy pedestal for award display,pedestal
rubber dukc in the bath,duck
show socks for the outfit planning feature,socks
apothecary symbol for dispensing,mortar-pestle
We need some music at this party,boombox
beard icon for a barber or grooming app,mustache
thumbnail image in a photo grid,image
Turn on the AC to cool down,fan
thrift store patch vest unique,vest-patches
mixed salad platter for restaurant,salad
followers users social profile,users
smartwatch always on display,watch-smart
Set up preferences in the app,gear
care note in the patient file,note-medical
d&d character wielding a magic sword,sword
checkers,game-board
keep some baht in cash,baht-sign
unlock with fingerprint,fingerprint
playlist in random shuffle order,shuffle
view the clinic patient list,hospital-user
dentist checkup with teeth and gums check,teeth
Bakery cake decorated for the event,cake-candles
football oval pigskin for American game,sportsball
convert dollars to litecoin,litecoin-sign
Trouble brewing in the cauldron,cauldron
crustacean with two large front claws,lobster
Clink glasses with everyone at the table,champagne-glasses
childrens shape sorter toy with blocks,shapes
star at center of solar system,sun
I really need a long hot bath tonight,bath
Subtraction of the discounts,calculator
ribbon,award
aerosol spary can with nozzle on top,spray-can
Register for the baseball league,baseball
wrapped gift ready for the party,gift
rent a shared scooter for a quick city ride,scooter
Set up a clean desktop workspace,display
unbounded,infinity
haul,trailer
gelatin capsule containing powdered medication,capsules
Save work frequently,floppy-disk
packaging,conveyor-belt
paper plane as send action in chat,paper-plane
dusk twilight last light,sunset
driving,steering-wheel
garage warehouse large storage,warehouse
strat play,play
gas,mask-ventilator
large moving truck on highway,truck-moving
Change the residence address,house
badmitnon racket for court game,racquet
pair of sissors with two blade handles,scissors
set the ac tempratrue,fan
toad,frog
Roll items to storage on the cart,cart-flatbed
ocean waves rolling onto the beach,water
testing,microscope
wizard magic wand casting,wand-magic
paw,raccoon
New York style thin crust slice,pizza
buy online with a credit card,credit-card
pigment blobs on oval palette,palette
athletics running shirt with number,shirt-running
sapling,seedling
Morning walk with the buggy,baby-carriage
Prep breakfast for the family,bacon
eletrcity meter,meter
pop to the loo,toilet
signboard,billboard
Reserve a table for dining,fork-knife
prayer rug folded for storage,rug
blueberry pie filling in a pastry shell,blueberries
handwashing station sign,hands-bubbles
alert notification from detector,sensor
Repair and repaint the fence,hammer-brush
garage sensor alert when door is left open,garage
fluffy hamster or mouse pet,mouse-field
bicuspid,tooth
Record the performance to disc,compact-disc
cellular antenna tower structure,tower-broadcast
mak a copy of the doc,copy
Hire a chimney sweep,chimney
medieval knight armed with spiked mace,mace
guaranee badge,award
Pie chart for the budget report,chart-pie
Buy groceries for the week,bag-shopping
pistol maintenance routine,gun
Run the query,database
tecnology chip,microchip
use the hospital bed for the patient profile page,bed
Dungeons and Dragons quest scroll unrolled,scroll
img data on portable card,sd-card
store bitcoin safely,bitcoin-sign
stretcher in emergency room,stretcher
hearing aid in the ear,ear
e-reader,tablet
basebal leageu season,baseball-bat
key icon for the password manager,key
bruce wayne,bat
cable,cable-car
podcast dynamic microphone on a desk arm,microphone
Budget the trip in hryvnia,hryvnia-sign
toggle slider on or off,slider
handheld magnifying tool,magnifying-glass
gold trophy for tournament winner,award
military fighter jet,plane
small tweeter dome on top of the speaker,speaker
trend,chart-gantt
salary check cashed at bank,money-check
convection,oven
Plan outdoor activities despite clouds,clouds-sun
body temperature measured with a thermometer,thermometer
load the truck with the forklift,forklift
beef burger patty for cooking,meat
localize places on regional map,map
umbrella with raindrops falling around it,umbrella
startup partnership formed with a handshake,handshake
Contact landlord about repairs,apartment
globe for online service,globe
geographic positioning crosshair symbol,location-crosshairs
key cut at the locksmith for a spare,car-key
Learn about wild animals,elephant
almost out of capsules need to reorder,capsules
Dyson cordless vacuum,vacuum
the chair wobbles — needs fixing,chair
