text,label
лопатка,pickleball
пиклбол,pickleball
виффл,pickleball
ракетка для пиклбола на корте,pickleball
легкая лопатка для пиклбола,pickleball
матч по пиклболу на открытом корте,pickleball
клуб пиклбола для сеньоров,pickleball
мяч виффл в игре пиклбол,pickleball
мяч виффл с отверстиями для воздуха,pickleball
лопатка и пластиковый дырчатый мяч,pickleball
играть в пиклбол с друзьями солнечным днем,pickleball
иконка спорта для pickleball club app,pickleball
цельная лопатка с короткой ручкой,pickleball
еженедельная лига пиклбола в recreation center,pickleball
иконка активности в sports scheduling app,pickleball
маленький пластиковый мяч рядом с лопаткой,pickleball
занятие по пиклболу для новичков в местном зале,pickleball
иконка рекреационного спорта для wellness tracker,pickleball
лопатка поднята для удара по мячу,pickleball
показать pickleball для court booking feature,pickleball
использовать pickleball для списка активностей,pickleball
ракетка для пиклбола в сумке,pickleball
бронирование корта для пиклбола,pickleball
пиклбол на открытом корте,pickleball
игра в пиклбол в парке,pickleball
теннисная ракетка с большой сеткой,pickleball
пушистый теннисный мяч на глине,pickleball
волан для бадминтона с перьями,pickleball
ракетка для бадминтона в замахе,pickleball
настольная ракетка с резиновой поверхностью,pickleball
белый мяч для пинг-понга на столе,pickleball
