text,label
acrylic,paint-roller
art,paint-roller
brush,paint-roller
color,paint-roller
fill,paint-roller
maintenance,paint-roller
paint,paint-roller
pigment,paint-roller
watercolor,paint-roller
acrylic paint roller application,paint-roller
acrylic wall coating with roller,paint-roller
art project using paint roller,paint-roller
large-scale art with roller,paint-roller
roller brush for wall painting,paint-roller
paint roller brush extension,paint-roller
color coverage with wide roller,paint-roller
apply color with paint roller,paint-roller
fill wall with flat paint roller,paint-roller
fill large areas quickly,paint-roller
home maintenance painting walls,paint-roller
maintenance repaint faded walls,paint-roller
paint roller for room renovation,paint-roller
paint wall with roller tool,paint-roller
pigment applied by roller evenly,paint-roller
pigment spread across large surface,paint-roller
watercolor roller effect on paper,paint-roller
watercolor application with roller,paint-roller
paint roller on a handle for wall painting,paint-roller
house painter rolling paint on wall,paint-roller
cover wall with smooth paint roller,paint-roller
paint roller tray and roller set,paint-roller
home renovation painting with roller,paint-roller
large foam roller for craft project,paint-roller
apply primer with paint roller,paint-roller
rolling paint ceiling with extension pole,paint-roller
paint roller leaving textured surface,paint-roller
interior painter using wall roller,paint-roller
I need a paint roller icon for the renovation feature,paint-roller
add a roller brush to the painting tools category,paint-roller
show a paint roller for the home maintenance section,paint-roller
use the roller icon for the fill color action,paint-roller
paint rollr wall,paint-roller
painitng roller brush,paint-roller
coloer fill roller,paint-roller
maitenance paint,paint-roller
paintbrush with fine tip for detail work,paint-roller
spray paint can for even coverage,paint-roller
paint bucket and fill tool icon,paint-roller
sponge for painting texture effects,paint-roller
palette knife for mixing paints,paint-roller
pressure washer for cleaning surfaces,paint-roller
