text,label
вечность,infinity
навсегда,infinity
бесконечность,infinity
математика,infinity
неограниченный,infinity
универсальный,infinity
вечность символ бесконечности,infinity
кольцо вечности в форме бесконечности,infinity
навсегда представлен бесконечной петлей,infinity
"любовь, которая длится вечно, символ бесконечности",infinity
знак бесконечности крутится бесконечно,infinity
"символ бесконечности, обозначающий безграничные возможности",infinity
Символ бесконечности в математике,infinity
обозначение бесконечности в математике,infinity
неограниченное множество бесконечности в математике,infinity
символ бесконечного неограниченного роста,infinity
универсальный символ множества в математике,infinity
универсальная бесконечность для всех вещей,infinity
"символ бесконечной петли, обозначающий бесконечность",infinity
"знак бесконечности, используемый в математических обозначениях",infinity
золотое колье бесконечность в подарок,infinity
символ бесконечности для безлимитной подписки,infinity
бесконечный цикл в анимации загрузки,infinity
татуировка бесконечности на запястье,infinity
Символ бесконечного цикла в разработке программного обеспечения,infinity
кольцо вечности с изображением бесконечности,infinity
"Символ бесконечности, используемый в логотипе бренда",infinity
лемниската бесконечная форма в исчислении,infinity
Мне нужен значок бесконечности для безлимитного плана,infinity
добавить символ бесконечности к функции вечности,infinity
показать бесконечный цикл для неограниченного уровня,infinity
используйте значок бесконечности для вечной подписки,infinity
цикл символа бесконечности,infinity
дизайн внутреннего кольца,infinity
бесконечная петля навсегда,infinity
"математика, обозначение бесконечности",infinity
фигура восьмерка лежит на боку,infinity
символ стрелки цикла переработки,infinity
Змея Уроборос ест свой хвост,infinity
"круговая стрелка, указывающая повтор или обновление",infinity
"звено цепи, образующее связную петлю",infinity
нулевая или овальная форма в системе счисления,infinity
