text,label
caption,subtitles
closed captions,subtitles
description,subtitles
language,subtitles
translation,subtitles
caption at bottom of screen,subtitles
live caption auto generated,subtitles
closed captions CC button video,subtitles
closed captions for deaf viewers,subtitles
audio description for visually impaired,subtitles
description track accessibility,subtitles
film subtitle foreign language,subtitles
film with subtitles enabled,subtitles
subtitle language selection menu,subtitles
change language subtitles,subtitles
movie subtitle white text,subtitles
movie subtitles synchronized,subtitles
text overlay subtitle style,subtitles
text subtitle lower third,subtitles
translation subtitle foreign film,subtitles
auto translation subtitle feature,subtitles
subtitles displayed at bottom of video frame,subtitles
CC button in video player controls,subtitles
foreign film with English subtitles,subtitles
accessibility closed captions for hearing impaired,subtitles
Netflix subtitle language selection,subtitles
subtitle font size and color settings,subtitles
auto generated subtitle via speech recognition,subtitles
subtitle timing adjustment synchronization,subtitles
burned in subtitle versus soft subtitle,subtitles
streaming platform enable subtitles option,subtitles
subtitels video player,subtitles
captoin on movie,subtitles
translaiton subtitle,subtitles
clossed captions,subtitles
