text,label
знак песо,peso-sign
знак мексиканского песо символ валюты,peso-sign
знак валюты филиппинского песо,peso-sign
обмен валюты курс песо,peso-sign
символ местной валюты песо,peso-sign
знак валюты филиппинского или мексиканского песо,peso-sign
символ песо на ценнике,peso-sign
иконка валюты латиноамериканского песо,peso-sign
обменный курс показывающий стоимость песо,peso-sign
оплата в валюте песо,peso-sign
цена в мексиканских песо,peso-sign
символ валюты песо в финансовом приложении,peso-sign
цена в филиппинских песо,peso-sign
знак песо для коммерческого приложения,peso-sign
конвертер валют показывающий песо,peso-sign
Мне нужна иконка знака песо для раздела валюты,peso-sign
добавить символ песо в финансовое приложение,peso-sign
показать знак песо для отображения цены,peso-sign
использовать иконку песо для экрана оплаты,peso-sign
знак пессо,peso-sign
валюта пеcо,peso-sign
симовл песо,peso-sign
песо валюта знак,peso-sign
знак доллара американская валюта,peso-sign
знак евро европейская валюта,peso-sign
фунт стерлингов британская валюта,peso-sign
иена японский символ валюты,peso-sign
рупия индийский знак валюты,peso-sign
символ криптовалюты биткоин,peso-sign
