text,label
admin,lock
closed,lock
lock,lock
locked,lock
padlock,lock
password,lock
privacy,lock
private,lock
protect,lock
security,lock
admin lock for restricted access,lock
lock for admin only area,lock
lock closed and secured,lock
closed lock on the door,lock
lock icon for the secure area,lock
lock the account,lock
locked icon showing secure,lock
file locked and protected,lock
padlock securing the gate,lock
padlock on the storage unit,lock
lock for password protected content,lock
password lock on the account,lock
privacy lock on personal data,lock
lock for user privacy,lock
private lock on the account,lock
lock for private content,lock
lock to protect the data,lock
protect with a lock,lock
security lock on the door,lock
lock for system security,lock
closed padlock indicating a secure area,lock
lock icon on the HTTPS website,lock
password protected by a lock symbol,lock
privacy lock on the settings page,lock
lock securing the storage locker,lock
locked file icon in the document list,lock
lock screen on the mobile phone,lock
admin lock for restricted system access,lock
lock symbol for private content,lock
combination lock on the school locker,lock
I need a lock icon for the security feature,lock
add a padlock symbol to the privacy settings,lock
show a lock for the password protected section,lock
use the lock icon for the secure area,lock
secruity lock on door,lock
padlokc on the gate,lock
prviacy lock settings,lock
lockd account icon,lock
unlocked open padlock with shackle raised,lock
metal key for the door lock,lock
door handle with a built-in lock,lock
combination safe with a dial,lock
fingerprint unlock scanner,lock
chain with a lock holding the gate,lock
