text,label
рождество,stocking
украшение,stocking
подарок,stocking
презент,stocking
носок,stocking
традиция,stocking
рождество-сокр,stocking
рождественский носок набитый подарками,stocking
вязаный узор рождественского носка,stocking
нейлоновый чулок предмет одежды,stocking
праздничное украшение носок на каминной полке,stocking
носок как праздничное украшение,stocking
подарок в носке сюрприз,stocking
подарок в носке для ребёнка,stocking
праздничный носок у трубы,stocking
нарядный рождественский носок традиция,stocking
презент внутри рождественского носка,stocking
подарки в носке для Санты,stocking
носок-чулок праздничный,stocking
длинный носок-украшение,stocking
традиция рождественского носка семейная реликвия,stocking
как началась традиция рождественского носка,stocking
рождественский носок с вышитым именем,stocking
именной рождественский носок,stocking
красно-белый вязаный рождественский носок,stocking
носок на каминной полке,stocking
именной семейный рождественский носок,stocking
гигантский праздничный носок,stocking
мелкие подарки в рождественском носке,stocking
Санта наполняет носки в рождественскую ночь,stocking
винтажный вышитый рождественский носок,stocking
несколько носков для всей семьи,stocking
носок с леденцом и мандарином,stocking
рождественский носок из фетра поделка,stocking
используй рождественский носок для праздничных событий,stocking
рождетвенский носок подарок,stocking
праздничный носк на полке,stocking
рождест-носок подвешен,stocking
украшение носок,stocking
подарочная коробка с лентой и бантом,stocking
рождественский шар на ёлке,stocking
шапка Санта-Клауса красная с белой отделкой,stocking
леденец полосатый праздничная конфета,stocking
венок зелёный праздничное украшение двери,stocking
обычный носок до щиколотки одежда,stocking
