text,label
gym,kettlebell
strength,kettlebell
exercise with the kettlebell,kettlebell
kettlebell exercise routine,kettlebell
gym kettlebell on the floor,kettlebell
kettlebell in the gym,kettlebell
strength training with kettlebell,kettlebell
build strength with kettlebell,kettlebell
kettlebell weight for lifting,kettlebell
weight of the kettlebell,kettlebell
workout with kettlebell swings,kettlebell
cast iron kettlebell on the gym floor,kettlebell
kettlebell swing exercise for strength,kettlebell
kettlebell snatch at the crossfit gym,kettlebell
row of kettlebells in different weights,kettlebell
kettlebell pressed overhead,kettlebell
kettlebell deadlift for the lower back,kettlebell
kettlebell workout for endurance,kettlebell
kettlebell goblet squat exercise,kettlebell
kettlebell Turkish get-up movement,kettlebell
home gym with kettlebells and dumbbells,kettlebell
kettlebal swing,kettlebell
kttlebell weight,kettlebell
gymn kettlebell,kettlebell
workuot with kettlebell,kettlebell
