text,label
building,industry
factory,industry
industrial,industry
manufacturing,industry
mill,industry
warehouse,industry
Visit the industrial building,industry
Inspect the building structure,industry
Tour the factory floor,industry
Work at the factory,industry
Work in an industrial zone,industry
Move to an industrial area,industry
Monitor the manufacturing line,industry
Improve manufacturing efficiency,industry
Visit the old mill,industry
Restore the historic mill,industry
Manage the warehouse operations,industry
Organize the warehouse floor,industry
Visit the manufacturing plant,industry
Inspect the factory equipment,industry
Work on the production line,industry
Manage warehouse operations,industry
Monitor industrial output,industry
Schedule a factory tour,industry
Improve industrial efficiency,industry
Order supplies for the factory,industry
Check safety at the industrial site,industry
Transport goods from the warehouse,industry
Factory tour,industry
Industrial site,industry
Warehouse check,industry
Production line,industry
viist the manufacurting plant,industry
inspekt the factroy,industry
work on productin line,industry
managge warehous operations,industry
Visit an office building,industry
Manage a retail store,industry
Work from a home office,industry
Run a small restaurant,industry
Open a retail shop,industry
Manage a farm operation,industry
