text,label
conectar,wifi
conexión,wifi
internet,wifi
red,wifi
señal,wifi
inalámbrico,wifi
WiFi,wifi
router,wifi
punto de acceso,wifi
banda ancha,wifi
ancho de banda,wifi
contraseña WiFi,wifi
módem,wifi
Ethernet,wifi
5 GHz,wifi
ajustes WiFi,wifi
punto de acceso WiFi,wifi
red mesh,wifi
conectarse al WiFi del hotel,wifi
pedir la contraseña WiFi en la recepción,wifi
arreglar la conexión WiFi en la habitación,wifi
configurar el router nuevo esta noche,wifi
reiniciar el módem para arreglar el internet,wifi
revisar la señal WiFi en el sótano,wifi
cambiar a una red mesh para la casa,wifi
el WiFi se cae durante las videollamadas,wifi
cambiar la contraseña WiFi esta semana,wifi
encender el punto de acceso en el celular,wifi
conectar la tele al WiFi,wifi
llamar al proveedor de internet por la velocidad lenta,wifi
comprar un extensor WiFi para el segundo piso,wifi
cambiar a la banda de 5 GHz para internet más rápido,wifi
compartir la contraseña WiFi con los invitados,wifi
el WiFi se cayó otra vez después de la tormenta,wifi
reiniciar el router antes de la reunión,wifi
encontrar WiFi gratis en la cafetería,wifi
configurar una red WiFi para invitados,wifi
el internet está muy lento para hacer streaming,wifi
mover el router a un mejor lugar,wifi
conectar la impresora a la red inalámbrica,wifi
olvidar y reconectarse al WiFi,wifi
revisar la factura de internet este mes,wifi
el WiFi no funciona en la laptop,wifi
actualizar el firmware del router esta noche,wifi
probar la velocidad de internet con el plan nuevo,wifi
el punto de acceso de la oficina necesita cambiarse,wifi
conectar el cable Ethernet para la llamada de trabajo,wifi
configurar control parental en el WiFi,wifi
la señal WiFi es débil en la cocina,wifi
programar la instalación de internet para el lunes,wifi
conectar las cámaras de seguridad al WiFi,wifi
ya se acabaron los datos del punto de acceso,wifi
necesito un mejor router para tantos dispositivos,wifi
pedirle al vecino la contraseña WiFi,wifi
conctarse al WiFi del hotel,wifi
contrseña WiFi en la recepción,wifi
arreglr la conexión WiFi,wifi
reinicir el router esta noche,wifi
internett muy lento para streaming,wifi
revisar la cobertura WiFi en toda la casa,wifi
