text,label
art,masks-theater
comedy,masks-theater
mask,masks-theater
perform,masks-theater
performing,masks-theater
performing arts,masks-theater
theater,masks-theater
theatre,masks-theater
tragedy,masks-theater
masks,masks-theater
masks theater,masks-theater
art después del trabajo,masks-theater
comedy después del trabajo,masks-theater
mask después del trabajo,masks-theater
perform después del trabajo,masks-theater
performing después del trabajo,masks-theater
performing arts después del trabajo,masks-theater
theater después del trabajo,masks-theater
theatre después del trabajo,masks-theater
tragedy después del trabajo,masks-theater
masks después del trabajo,masks-theater
masks theater después del trabajo,masks-theater
art para el viaje,masks-theater
comedy para el viaje,masks-theater
mask para el viaje,masks-theater
perform para el viaje,masks-theater
performing para el viaje,masks-theater
performing arts para el viaje,masks-theater
theater para el viaje,masks-theater
theatre para el viaje,masks-theater
tragedy para el viaje,masks-theater
masks para el viaje,masks-theater
masks theater para el viaje,masks-theater
buscar art en línea,masks-theater
buscar comedy en línea,masks-theater
buscar mask en línea,masks-theater
buscar perform en línea,masks-theater
buscar performing en línea,masks-theater
buscar performing arts en línea,masks-theater
buscar theater en línea,masks-theater
buscar theatre en línea,masks-theater
buscar tragedy en línea,masks-theater
buscar masks en línea,masks-theater
buscar masks theater en línea,masks-theater
buscar art,masks-theater
buscar comedy,masks-theater
buscar mask,masks-theater
buscar perform,masks-theater
buscar performing,masks-theater
buscar performing arts,masks-theater
buscar theater,masks-theater
buscar theatre,masks-theater
buscar tragedy,masks-theater
buscar masks,masks-theater
buscar masks theater,masks-theater
perfforming,masks-theater
theatre pra el viaje,masks-theater
bucsar performing,masks-theater
art después del tarbajo,masks-theater
buscar perform en líena,masks-theater
