text,label
comedy,masks-theater
perform,masks-theater
performing,masks-theater
performing arts,masks-theater
theatre,masks-theater
tragedy,masks-theater
performing art gallery installation,masks-theater
visual art and theater combined,masks-theater
comedy show with laughing mask,masks-theater
comedy and drama theater masks,masks-theater
theater mask worn by actor,masks-theater
Greek drama theater mask,masks-theater
perform on stage with masks,masks-theater
perform in front of live audience,masks-theater
performing arts center schedule,masks-theater
performing arts festival,masks-theater
performing arts masks comedy and tragedy,masks-theater
performing arts symbol masks,masks-theater
theater masks hanging on wall,masks-theater
Broadway theater iconic masks,masks-theater
theatre production masks decor,masks-theater
theatre performance symbol,masks-theater
tragedy mask with downturned mouth,masks-theater
Greek tragedy mask dramatic,masks-theater
comedy and tragedy masks side by side,masks-theater
classic Greek theater drama masks,masks-theater
happy and sad faces of theatrical masks,masks-theater
Broadway drama masks symbol,masks-theater
smiling and frowning mask pair,masks-theater
theater department logo with masks,masks-theater
drama club masks for performance,masks-theater
Melpomene and Thalia theater masks,masks-theater
actor behind theatrical face mask,masks-theater
film and theater arts program symbol,masks-theater
I need theater masks icon for the arts section,masks-theater
add drama masks to the entertainment category,masks-theater
show comedy and tragedy masks for the theater app,masks-theater
theather masks,masks-theater
comdy and tragedy masks,masks-theater
perfoming arts masks,masks-theater
teatre masks,masks-theater
