text,label
utilities,meter
electricity meter measuring usage,meter
power transmission measurement,meter
signal transmission meter,meter
utility meter for water and gas,meter
utilities billing meter reading,meter
electric meter on side of house,meter
digital utility meter reading,meter
analog dial meter for electricity,meter
smart meter for home energy monitoring,meter
gas meter in basement utility room,meter
water meter reading for billing,meter
measuring instrument with gauge dial,meter
power consumption meter display,meter
utility worker reading a meter,meter
meter box on exterior wall,meter
add an electricity meter to the energy tracker,meter
eletrcity meter,meter
utiltiy meter reading,meter
meeter dial,meter
electircity usage,meter
electricity meter mounted on the exterior wall,meter
analog dial meter with multiple dials,meter
digital smart meter for home energy tracking,meter
gas meter reading in the basement,meter
water meter installed near the main pipe,meter
meter reader visiting for monthly billing,meter
prepaid electricity meter with credit display,meter
three-phase electric meter for industrial use,meter
meter cabinet locked on the building exterior,meter
tamper-evident seal on the utility meter,meter
sub-meter for individual apartment energy use,meter
utility meter spinning during peak usage,meter
meter data uploaded to the cloud for billing,meter
broken utility meter reported to the provider,meter
meter box cover opened for inspection,meter
add an electricity meter to the utilities screen,meter
eletrcity meeter on the wall,meter
utility meeter reading the dials,meter
smart meeter for home energy,meter
gass meter in the basement,meter
wateer meter near the main pipe,meter
meter readnig for billing,meter
