text,label
arrow,shuffle
arrows,shuffle
crossed,shuffle
shuffle,shuffle
shuffle tracks button,shuffle
sort,shuffle
swap,shuffle
switch,shuffle
transfer,shuffle
crossed arrows shuffle icon,shuffle
arrow pair crossing to indicate shuffle,shuffle
two arrows crossing for shuffle,shuffle
arrows pointing in opposite direction,shuffle
shuffle icon with crossed arrows,shuffle
shuffle button in music player,shuffle
shuffle tracks button in playlist,shuffle
tap shuffle for random playback,shuffle
sort items in random shuffle order,shuffle
sort list randomly with shuffle,shuffle
swap two items position,shuffle
swap card order in deck,shuffle
switch to shuffle mode for songs,shuffle
switch order randomly,shuffle
transfer items between lists shuffled,shuffle
transfer between queues with shuffle,shuffle
shuffle button with two crossed arrows,shuffle
music player shuffle mode activated,shuffle
playlist in random shuffle order,shuffle
shuffle deck of cards randomly,shuffle
crossed arrows indicating random order,shuffle
shuffle icon in Spotify or Apple Music,shuffle
randomize list with shuffle function,shuffle
shuffle algorithm mixing array elements,shuffle
crossed arrows transfer swap icon,shuffle
shuffle mode toggled on for music,shuffle
I need a shuffle icon for the music player,shuffle
add a shuffle symbol to the playlist controls,shuffle
show a shuffle button for the random playback feature,shuffle
use the shuffle icon for the randomize option,shuffle
shuffel button with two crossed arrows,shuffle
musci player shuffle mode activated,shuffle
randomzie list with shuffle function,shuffle
shuffel mode toggled on for music,shuffle
repeat button looping same track,shuffle
next track arrow skipping forward,shuffle
previous track arrow going back,shuffle
random order dice for board game,shuffle
sort ascending alphabetical order arrow,shuffle
swap exchange two items positions,shuffle
