text,label
грифель,pencil
сделать макет карандашным наброском,pencil
черновой эскиз карандашом на миллиметровке,pencil
нарисовать быстрый скетч карандашом,pencil
рисовать от руки линии на холсте,pencil
редактировать поле текста через карандаш,pencil
режим редактирования включен иконкой карандаша,pencil
острый грифель простого карандаша,pencil
грифельный след карандаша на бумаге,pencil
иконка обслуживания для настроек приложения,pencil
запланировать обслуживание через кнопку карандаша,pencil
изменить запись нажатием на карандаш,pencil
изменить существующие данные в форме,pencil
желтый карандаш с розовым ластиком,pencil
иконка карандаша для редактируемого контента,pencil
обновить запись через карандаш,pencil
обновить профиль с иконкой карандаша,pencil
писать заметки от руки карандашом,pencil
писать в скетчбуке остро заточенным карандашом,pencil
желтый деревянный карандаш с острым кончиком,pencil
нажать на карандаш чтобы перейти в edit mode,pencil
кнопка редактирования в content management system,pencil
карандаш с розовым ластиком на конце,pencil
рисование свободного эскиза на бумаге,pencil
иконка design tool для creative app,pencil
шестигранный корпус желтого карандаша,pencil
иконка карандаша рядом с редактируемым полем,pencil
приложение для заметок с символом карандаша,pencil
заточенный карандаш оставляет графитовую линию,pencil
добавить символ карандаша к кнопке редактирования,pencil
показать карандаш для drawing canvas,pencil
использовать карандаш для функции изменения профиля,pencil
карандаш для рисования,pencil
карандашный набросок на бумаге,pencil
иконка карандаша для редактирования,pencil
рисунок карандашом на бумаге,pencil
перьевая ручка пишет чернилами,pencil
шариковая ручка на столе,pencil
толстый маркер рисует жирную линию,pencil
текстовыделитель без колпачка,pencil
деревянная линейка с делениями,pencil
металлическая линейка на чертежном столе,pencil
Lower Left Pencil,pencil
design,pencil
draw,pencil
edit,pencil
lead,pencil
maintenance,pencil
modify,pencil
pencil,pencil
update,pencil
write,pencil
Lower Left Pencil для детей,pencil
design для детей,pencil
draw для детей,pencil
edit для детей,pencil
lead для детей,pencil
maintenance для детей,pencil
modify для детей,pencil
pencil для детей,pencil
