text,label
atmosphere,cloud
fog,cloud
upload,cloud
cloud floating in the earth's atmosphere,cloud
atmosphere layer with white clouds,cloud
fluffy white cloud in the sky,cloud
cloud passing slowly overhead,cloud
morning fog and low cloud cover,cloud
foggy cloud at dawn,cloud
overcast sky with dark clouds all day,cloud
overcast cloud cover blocking the sun,cloud
save your files to the cloud,cloud
save to cloud storage automatically,cloud
upload photos to cloud storage,cloud
cloud upload in progress,cloud
cloud weather forecast icon,cloud
weather app showing cloudy skies,cloud
fluffy white cloud floating in the blue sky,cloud
dark storm cloud building on the horizon,cloud
cloud storage icon for saving files,cloud
upload data to the cloud service,cloud
overcast sky covered with gray clouds,cloud
morning fog with low cloud cover,cloud
single cloud passing over the bright sun,cloud
cloud computing server symbol,cloud
weather forecast showing cloudy conditions,cloud
cloud syncing data across all devices,cloud
clod storage upload,cloud
overacst sky today,cloud
uploaed photos to cloud,cloud
weatehr showing cloud,cloud
