text,label
add-on,puzzle
addon,puzzle
clue,puzzle
interlocking,puzzle
jigsaw,puzzle
piece,puzzle
puzzle,puzzle
puzzle piece,puzzle
section,puzzle
browser add-on for extending functionality,puzzle
software add-on plugin,puzzle
addon component for custom features,puzzle
addon installed in the application,puzzle
clue to solving the puzzle,puzzle
missing clue piece in a mystery game,puzzle
strategy game with puzzle mechanics,puzzle
board game puzzle challenge,puzzle
interlocking puzzle pieces fitting together,puzzle
interlocking sections of a jigsaw,puzzle
jigsaw pieces sorted by color,puzzle
missing piece of the jigsaw puzzle,puzzle
last piece placed in puzzle,puzzle
puzzle challenge to solve on rainy day,puzzle
puzzle icon representing modularity,puzzle
puzzle piece shaped browser extension icon,puzzle
puzzle piece fitting into slot,puzzle
section of a larger puzzle image,puzzle
highlighted section in a complex puzzle,puzzle
classic cardboard jigsaw puzzle with interlocking pieces,puzzle
missing puzzle piece that completes the picture,puzzle
browser extension icon shaped like a puzzle piece,puzzle
colorful puzzle spread across the dining table,puzzle
500-piece puzzle of a landscape scene,puzzle
puzzle metaphor for problem solving and logic,puzzle
plugin or add-on represented as a puzzle piece,puzzle
interlocking tabs and blanks of jigsaw pieces,puzzle
child playing with large foam puzzle floor mat,puzzle
3D puzzle cube challenge on a desk,puzzle
jigsaw puzle spread on table,puzzle
missing peice of the puzzle,puzzle
brwoser extension puzzle icon,puzzle
interlcoking puzzle pieces,puzzle
