text,label
objective,bullseye-pointer
Archery accuracy with pointer guidance,bullseye-pointer
Goal setting with interactive pointer,bullseye-pointer
Precise objective tracking with cursor,bullseye-pointer
Strategy pointer for the presentation,bullseye-pointer
Target selection with pointer tool,bullseye-pointer
Click on the exact target point,bullseye-pointer
Pointer aimed at the bullseye,bullseye-pointer
Interactive target selection,bullseye-pointer
Drag pointer to the target location,bullseye-pointer
Pinpoint the exact location on map,bullseye-pointer
Cursor precisely on the goal,bullseye-pointer
Point and click at the objective,bullseye-pointer
Sniper-style cursor targeting,bullseye-pointer
Focus pointer on the key area,bullseye-pointer
Align cursor with the bullseye,bullseye-pointer
just click right there on target,bullseye-pointer
pointer aimed exactly at it,bullseye-pointer
move the cursor to the goal,bullseye-pointer
tap the center of the target,bullseye-pointer
click the traget spot,bullseye-pointer
poitner on the bullseye,bullseye-pointer
cursor on the objetive,bullseye-pointer
aim the poiner at the center,bullseye-pointer
Archery range session this Saturday,bullseye-pointer
Point the cursor at the goal marker,bullseye-pointer
Click the objective on the dashboard,bullseye-pointer
Interactive strategy map walkthrough,bullseye-pointer
Tap the target to confirm selection,bullseye-pointer
