text,label
sharpie,marker
design element drawn with marker,marker
graphic design tool marker,marker
edit notes with a marker pen,marker
edit text marker for annotation,marker
modify drawing with thick marker,marker
modify layout using marker,marker
Sharpie permanent marker for labeling,marker
Sharpie felt-tip pen marking,marker
update whiteboard with a marker,marker
update label with fresh marker,marker
write on whiteboard with marker,marker
write name tag with black marker,marker
thick felt-tip marker pen for drawing,marker
Sharpie-style permanent black marker,marker
whiteboard marker for presentations,marker
highlighter marker for text annotation,marker
writing on a sign with a bold marker,marker
artist sketching with a chisel-tip marker,marker
labeling boxes with a black marker,marker
color marker for children's craft,marker
edit symbol showing a pen or marker,marker
annotation tool in a document editor,marker
I need a marker icon for the annotation feature,marker
add a pen or marker to the drawing toolbar,marker
show a marker symbol for the edit action,marker
use the marker icon for the whiteboard mode,marker
sharipe marker,marker
wihiteboard marker,marker
eidt with marker,marker
markre pen,marker
