text,label
carry,trailer
haul,trailer
moving,trailer
travel,trailer
carry load trailer hitched,trailer
carry goods trailer freight,trailer
haul trailer heavy load,trailer
haul truck and trailer combo,trailer
moving trailer rental truck,trailer
moving furniture in trailer,trailer
travel trailer camper tow,trailer
road trip travel trailer,trailer
semi truck with long cargo trailer,trailer
flatbed trailer carrying equipment,trailer
camper trailer attached to SUV,trailer
horse trailer towing vehicle,trailer
enclosed trailer for moving furniture,trailer
boat trailer launching at ramp,trailer
car transport trailer multiple vehicles,trailer
utility trailer home depot rental,trailer
trailer hitch ball mount,trailer
trailer brake lights signal,trailer
I need a trailer icon for the moving section,trailer
add a haul symbol to the transport category,trailer
show a trailer for the road trip planning,trailer
use the trailer icon for the cargo feature,trailer
trailre hitch moving,trailer
movign trailer rental,trailer
haul tailer cargo,trailer
travle trailer camper,trailer
truck semi large vehicle,trailer
van cargo delivery vehicle,trailer
RV motorhome self-propelled,trailer
boat on water vessel,trailer
shipping container large box,trailer
pickup truck bed cargo,trailer
