text,label
art,hammer-brush
fix,hammer-brush
hammer,hammer-brush
maintenance,hammer-brush
paint,hammer-brush
remodel,hammer-brush
repair,hammer-brush
tool,hammer-brush
Use art tools for the project,hammer-brush
Create art with tools,hammer-brush
Fix and paint the wall,hammer-brush
Fix the surface before painting,hammer-brush
Use a hammer to prep the surface,hammer-brush
Hammer down loose nails before painting,hammer-brush
Do regular maintenance on the home,hammer-brush
Schedule home maintenance,hammer-brush
Paint the living room walls,hammer-brush
Apply a fresh coat of paint,hammer-brush
Remodel the kitchen,hammer-brush
Plan the bathroom remodel,hammer-brush
Repair and repaint the fence,hammer-brush
Repair the damaged wall,hammer-brush
Pick the right tool for painting,hammer-brush
Buy the right tools for the project,hammer-brush
Renovate the living room,hammer-brush
Paint the walls and fix the trim,hammer-brush
Repair and paint the fence,hammer-brush
Do a home improvement project,hammer-brush
Buy paint and tools for the renovation,hammer-brush
Prep the wall before painting,hammer-brush
Touch up the paint in the hallway,hammer-brush
Fix cracks and repaint the wall,hammer-brush
Hire a handyman for repairs,hammer-brush
Remodel the bathroom,hammer-brush
Home reno,hammer-brush
Fix and paint,hammer-brush
DIY project,hammer-brush
Handyman time,hammer-brush
renovte the livign room,hammer-brush
paint the wallls,hammer-brush
fix and repiant the fence,hammer-brush
home imporvement project,hammer-brush
Use only a hammer for nailing,hammer-brush
Use only a paintbrush for art,hammer-brush
Hire a plumber for pipe repair,hammer-brush
Use a screwdriver to fix screws,hammer-brush
Sweep the floor with a broom,hammer-brush
Use a roller to paint the ceiling,hammer-brush
