text,label
boat,ship
passenger,ship
sea,ship
ship,ship
large ocean-going boat with multiple decks,ship
boat icon for a maritime travel app,ship
passenger ship crossing the Atlantic,ship
passenger ferry docking at the port,ship
ship sailing across the open sea,ship
sea voyage on a merchant vessel,ship
cargo ship loaded with containers at the dock,ship
ship icon for a shipping or logistics app,ship
water vessel navigating through ocean waves,ship
water route planned for the cargo ship,ship
large ocean vessel with a tall smokestack,ship
cargo ship delivering goods across the ocean,ship
shipping icon for a logistics or freight app,ship
side view of a ship with multiple decks,ship
book a cruise ship voyage across the Mediterranean,ship
maritime transport icon for a port management app,ship
ship hull cutting through blue ocean waves,ship
container ship departing from a busy seaport,ship
naval vessel icon in a geography or travel app,ship
silhouette of a large ship on the horizon,ship
I need a ship icon for my shipping tracker app,ship
add a ship symbol to the maritime transport section,ship
show a ship for the ocean freight feature,ship
use the ship icon for the cruise booking screen,ship
shpi crossing the Atlantic,ship
shiip arriving at the port,ship
shup docking at the harbor,ship
shio on the open sea,ship
