text,label
биск,bowl-hot
бульон,bowl-hot
миска,bowl-hot
отвар,bowl-hot
куриный,bowl-hot
чаудер,bowl-hot
гаспачо,bowl-hot
рамен,bowl-hot
рагу,bowl-hot
лобстерный биск в теплой миске,bowl-hot
кремовый биск с завитком сливок,bowl-hot
бульонный кубик растворили в горячей воде,bowl-hot
куриный бульон для быстрого супа,bowl-hot
миска горячего супа на столе,bowl-hot
керамическая миска с крышкой держит тепло,bowl-hot
теплый бульон в холодный вечер,bowl-hot
бульон налили в миску из кастрюли,bowl-hot
куриный суп как средство от простуды,bowl-hot
куриный суп с лапшой в глубокой миске,bowl-hot
чаудер подают в хлебной миске,bowl-hot
густой new england chowder со сливками,bowl-hot
холодный гаспачо налит в охлажденную миску,bowl-hot
гаспачо приготовлен из свежих томатов,bowl-hot
миска рамэна с мягким яйцом,bowl-hot
парящий рамэн подали к столу,bowl-hot
говяжье рагу томилось три часа,bowl-hot
сытное рагу с овощами и клецками,bowl-hot
дымящаяся миска горячего супа,bowl-hot
керамическая миска с рамэном и топпингами,bowl-hot
иконка горячей миски для food delivery app,bowl-hot
миска бульона с лапшой и овощами,bowl-hot
куриный суп в большой белой миске,bowl-hot
рагу разливают по мискам к ужину,bowl-hot
горячая миска чаудера на деревянном столе,bowl-hot
пар поднимается от свежей миски,bowl-hot
эмодзи супа в миске для comfort food app,bowl-hot
лапша быстрого приготовления разогрета в микроволновке,bowl-hot
показать дымящуюся миску для горячих блюд,bowl-hot
использовать bowl-hot для категории рамэна,bowl-hot
дымящаяся миска рамэна с яйцом,bowl-hot
куриный суп в большой керамической миске,bowl-hot
горячая миска рагу на обеденном столе,bowl-hot
миска рамэна с нори и яйцом,bowl-hot
тарелка как плоская посуда,bowl-hot
кружка с ручкой для кофе или чая,bowl-hot
кастрюля на плите,bowl-hot
салатница с холодной зеленью,bowl-hot
чашка с блюдцем для напитка,bowl-hot
половник для разлива супа,bowl-hot
