text,label
covid-19,microscope
электрон,microscope
знания,microscope
линза,microscope
микроскоп,microscope
оптика,microscope
наука,microscope
уменьшить,microscope
тестирование,microscope
инструмент,microscope
клетка covid-19 под микроскопом,microscope
исследование вируса covid-19 с микроскопом,microscope
изображение материала под электронным микроскопом,microscope
нанотехнологии электронной микроскопии,microscope
научные знания через микроскопию,microscope
знания полученные в лабораторных исследованиях,microscope
линза микроскопа фокусирующаяся на образце,microscope
увеличение оптической линзы,microscope
микроскоп для урока биологии,microscope
лабораторный микроскоп для образца,microscope
оптика в составном микроскопе,microscope
оптический прибор для исследования,microscope
научный эксперимент с микроскопом,microscope
использование микроскопа в научной лаборатории,microscope
уменьшение объектов в поле зрения микроскопа,microscope
под микроскопом всё выглядит уменьшенным,microscope
тестирование образцов под микроскопом,microscope
контроль качества с микроскопом,microscope
инструмент для научного исследования,microscope
лабораторный инструмент для изучения клеток,microscope
составной микроскоп для биологической лаборатории,microscope
учёный смотрящий в окуляр микроскопа,microscope
предметное стекло с образцом на столике,microscope
мощный исследовательский микроскоп,microscope
микроскоп на уроке школьной науки,microscope
лаборант медицинской лаборатории использующий микроскоп,microscope
электронный микроскоп для нанотехнологий,microscope
судебно-медицинский микроскоп для улик,microscope
иконка микроскопа для приложения исследования,microscope
увеличенный вид клетки под оптическим микроскопом,microscope
Мне нужна иконка микроскопа для раздела науки,microscope
добавить лабораторный микроскоп в категорию инструментов исследования,microscope
показать микроскоп для приложения биологии,microscope
использовать иконку микроскопа для модуля тестирования,microscope
микросоп биология,microscope
науак микроскоп,microscope
электорнный микроскоп,microscope
лаборотория микроскоп,microscope
лупа для приближения,microscope
телескоп для астрономических наблюдений,microscope
бинокль для наблюдения на расстоянии,microscope
пробирка для химических экспериментов,microscope
очки или очки для чтения,microscope
объектив камеры для фотографии,microscope
