text,label
жёсткий диск,sim-card
оборудование,sim-card
портативный,sim-card
хранение,sim-card
технология,sim-card
крошечный,sim-card
SIM-карта маленькое хранилище как жёсткий диск,sim-card
мобильный накопитель как SIM для данных,sim-card
SIM-карта как компонент оборудования телефона,sim-card
оборудование телефона включает слот SIM,sim-card
портативная SIM-карта между устройствами,sim-card
портативная крошечная карта для мобильной сети,sim-card
SIM-карта хранит данные контактов,sim-card
SIM-карта хранит учётные данные сети,sim-card
технология SIM-карты для мобильных сетей,sim-card
технология eSIM на устройстве,sim-card
крошечная SIM-карта с золотыми контактами,sim-card
маленькая нано SIM в лотке,sim-card
нано-SIM вставлена в лоток телефона,sim-card
слот SIM-карты на боку смартфона,sim-card
извлечение SIM-карты булавкой,sim-card
телефон с двумя SIM-картами,sim-card
виртуальная eSIM заменяет физическую карту,sim-card
SIM-карта от мобильного оператора,sim-card
SIM-карта разблокирована для международных поездок,sim-card
предоплаченная SIM-карта из магазина,sim-card
мне нужна иконка SIM-карты для мобильных настроек,sim-card
добавь символ SIM-карты в раздел подключения,sim-card
покажи SIM-карту для функции сетевых настроек,sim-card
используй иконку SIM-карты для выбора оператора,sim-card
нано-SIM вставелна в лоток телефона,sim-card
слот SIM-катры на боку смартфона,sim-card
извлечение SIM-катры булавкой,sim-card
телефон с двуямя SIM-картами,sim-card
SD-карта для хранения фото камеры,sim-card
microSD-карта для хранения телефона,sim-card
кредитная карта с чипом и подписью,sim-card
USB-накопитель в порту ноутбука,sim-card
NFC-чип для бесконтактной оплаты,sim-card
удостоверение личности с фото и штрихкодом,sim-card
