text,label
address,microphone
information,microphone
podcast,microphone
public,microphone
talking,microphone
voice,microphone
public address system microphone,microphone
address the audience with microphone,microphone
audio recording microphone setup,microphone
audio input for live streaming,microphone
information booth with microphone,microphone
information desk with mic,microphone
podcast recording microphone,microphone
podcast host speaking into mic,microphone
public speaking microphone at podium,microphone
public event microphone on stage,microphone
record voice with studio microphone,microphone
record audio for video production,microphone
sing into a microphone on stage,microphone
sing karaoke into a handheld mic,microphone
sound capture with directional mic,microphone
sound recording equipment,microphone
talking into a conference microphone,microphone
talking to voice assistant,microphone
voice command microphone activation,microphone
voice recognition input,microphone
handheld microphone for live performance,microphone
condenser microphone for studio recording,microphone
lavalier clip-on microphone for interviews,microphone
podcast dynamic microphone on a desk arm,microphone
karaoke microphone for singing,microphone
voice dictation microphone icon in app,microphone
speech-to-text microphone button,microphone
stage microphone on a stand,microphone
press conference microphone cluster,microphone
reporter holding a news microphone,microphone
I need a microphone icon for the voice recording feature,microphone
add a mic symbol to the podcast section,microphone
show a microphone for the speech input button,microphone
use the microphone icon for the audio capture screen,microphone
micropohne recording,microphone
podcsat microphone,microphone
microphoen for singing,microphone
vocie recording mic,microphone
