text,label
exchange,reflect-both
flip,reflect-both
horizontal,reflect-both
inverse,reflect-both
invert,reflect-both
mirror,reflect-both
negative,reflect-both
reflect,reflect-both
swap,reflect-both
vertical,reflect-both
edit tool for flipping image both axes,reflect-both
image edit with reflect on both sides,reflect-both
exchange left and right sides of image,reflect-both
exchange axis to mirror layout,reflect-both
flip image horizontally and vertically,reflect-both
flip both axes in photo editor,reflect-both
horizontal axis reflection in design tool,reflect-both
horizontal mirror line in vector editor,reflect-both
inverse transform on both dimensions,reflect-both
inverse mapping for symmetrical design,reflect-both
invert both axes of an image,reflect-both
invert and reflect symmetrically,reflect-both
mirror effect applied to both sides,reflect-both
mirror image along center axes,reflect-both
negative space created by both-axis reflection,reflect-both
negative image flip on canvas,reflect-both
reflect object across both center lines,reflect-both
reflect both horizontally and vertically,reflect-both
swap x and y axis orientation,reflect-both
swap image direction on both axes,reflect-both
target symmetry using reflect both tool,reflect-both
target center point for dual reflection,reflect-both
design tool for creating symmetrical layouts,reflect-both
tool for mirroring objects both ways,reflect-both
vertical and horizontal reflection combined,reflect-both
vertical axis flip in graphic editor,reflect-both
reflect both axes button in vector design software,reflect-both
mirroring object symmetrically across center point,reflect-both
creating butterfly symmetry by reflecting both sides,reflect-both
design tool creating a four-way symmetric pattern,reflect-both
negative image created by full axis inversion,reflect-both
swap image orientation on both x and y axes,reflect-both
mandala design tool reflecting in all four quadrants,reflect-both
photo editor reflect both option for symmetry art,reflect-both
icon design using both-axis reflection for balance,reflect-both
relect both axes in design tool,reflect-both
mirro image along center axes,reflect-both
fliip horizontal and vertical combined,reflect-both
swpa x and y axis orientation,reflect-both
edit,reflect-both
target,reflect-both
both,reflect-both
reflect both,reflect-both
edit for Saturday,reflect-both
exchange for Saturday,reflect-both
flip for Saturday,reflect-both
horizontal for Saturday,reflect-both
inverse for Saturday,reflect-both
invert for Saturday,reflect-both
mirror for Saturday,reflect-both
